"id","texto","palavras"
"F0038","É sobre os modos de ser que contêm modos de pensar, de agir, de estar e de se relacionar. Os modos de pensar são expressões internas desses modos de ser. A variedade humana é enorme em potencialidades, capacidades e possibilidades, sendo legítimo formular proposições verdadeiras sobre essas diferenças verificadas. Existe uma correspondência necessária entre capacidades e apropriação a determinados setores, algo que já fazemos implicitamente. A estrutura do universo revela-se na criação e transmissão do conhecimento: não basta descobrir algo, é necessário descrevê-lo de modo que outros o possam repetir, sob pena de a ideia desaparecer. A permanência cultural exige transmissibilidade. A avaliação de competências leva naturalmente à avaliação psicológica, pois o modo de ser condiciona a análise verdadeira dos problemas fundamentais da vida — quem sou, que tipo de pessoa quero ser, com quem me devo ligar, se devo ter filhos. Sem um modo de ser que imponha estas perguntas, elas nem sequer se colocam. A correção de percurso raramente é reflexiva; ocorre geralmente por trauma, devido à resistência natural à mudança e à inação corretiva. Quando a correção não é reflexiva, torna-se traumática. Tudo isto decorre de auto-evidências do próprio sistema: a realidade só pode ser assim, pois qualquer processo exige estrutura, continuidade e possibilidade de correção.","209"
"F0039","Dois blocos fundamentais definem o caminho que se percorre, ainda que de forma imaginária. A pergunta central é sempre: o que é isto? O que é viver aqui, nisto? É a realidade. Nós na realidade. O que é ser espécie humana? O que é ser animal? A origem é hoje amplamente explicável pela evolução: comportamentos ao longo de milhares de anos moldaram características corporais. Isto liga-se diretamente ao que somos nós — não apenas seres pensantes, mas entidades corporais integradas. O corpo e o pensamento estão ligados; as redes neuronais não se restringem ao cérebro. O pai e o filho percorrem a vida juntos, o filho cresce, o pai morre, o ciclo continua. Mesmo que não se viva de acordo com o passado, a verdade permanece. Eventos externos — como meteoritos — mostram que a realidade impõe condições independentes da vontade. A continuidade do modo de ser é necessária: não como repetição absoluta, mas como enquadramento. Mudanças exigem correção de hábitos e não ocorrem de um dia para o outro. Se encarnamos um modo de ser, somos esse modo até que ações efetivas nos tornem diferentes.","186"
"F0040","Nem sempre somos aquilo que somos: há acontecimentos que irrompem fora do modo de ser estabilizado e que funcionam como aberturas da própria vida. Quando algo acontece e depois perdura e se estabiliza, então passa a integrar quem somos. A lógica não está reservada a elites; as leis universais aplicam-se à vida comum. Modos de tratamento linguístico revelam modos de ser. Num mundo de IA, quando os produtos se tornam indistinguíveis dos humanos, o único critério restante para o humano conhecer a realidade é a verdade. Não é necessário saber tudo, apenas conhecer como a vida é e como o homem é dentro da realidade. As sociedades substituíram códigos morais, crenças e arquétipos transmitidos como verdadeiros, orientadores do modo de ser. A remoção dessa estrutura conduz ao relativismo e à perda de continuidade da mente e da sociedade. Daí decorre não apenas o absurdo, mas a produção de proposições maléficas, resultantes da dissolução dos modos de ser coletivos.","158"
"F0041","Chega-se hoje a afirmar seriamente que a realidade não existe e que apenas o que se sente existe. Daí decorrem posições em que qualquer critério se torna justificável: se sou homem posso ser mulher; se o bebé está apenas dentro de mim, encontra-se sempre um argumento para justificar o seu extermínio. Não se trata já de reconhecer o erro e ocultá-lo, mas de justificar culturalmente a posição como verdadeira e boa. Como a realidade deixa de fazer parte da equação, a justificação desloca-se para um cientificismo, uma racionalidade ou um formalismo qualquer. Neste contexto, Deus surge como a melhor ideia e ferramenta civilizacional, aperfeiçoada por Cristo, pela apreensão imediata de uma ideia centrada no homem.","115"
"F0042","A questão central é que é a verdade do ser que a esquerda necessita da direita para se enquadrar; sem isso, degenera. A direita fornece a ciência e a espada; a esquerda, o ideal e a morte. Trata-se de uma necessidade do sistema: a forma preserva-se nos seus meandros, especialmente com a existência de meios de comunicação que ultrapassam o local. Estamos neste ponto da história humana: descobrimos o processo e adaptamo-nos a ele, até que aquilo que sustenta o processo se imponha. Tudo isto são tautologias: o real descobre-se observando o movimento dos ponteiros do relógio da vida humana. Os ponteiros são os homens — se fossem pedras, as horas não mudariam. O real é o real. A relação, ainda enquanto relação, continua a ser real.","127"
"F0043","Este modo de ser do homem aplica-se a tudo. Marx descreveu o materialismo económico: descreveu uma parte do processo, ao identificar tensões entre pessoas, entre minicírculos e entre minicírculos e grandes círculos. Descobriu algo real, mas, como é típico, à descrição incompleta acrescentou normatividade, proporções valorativas e atribuição de valor. É o que o homem faz. Os estruturalistas aprofundaram este movimento. Não é inevitável que a descoberta de um processo venha acompanhada da descrença no seu fundamento ou no que o sustenta. Esta é mais uma verdade necessária que decorre da existência de sistemas com entes conscientes de si próprios. O modo de ser humano manifesta sempre a mesma dualidade: permanecer na caverna e morrer à fome ou sair para caçar leões. Defender-se, proteger-se, conservar o que é — mas conservar obriga a conhecer o que é. Conhecer não pode ser apenas conservação local e imediata. A busca pelo desconhecido também exige conservação. Esta não é uma distinção criada pelo pós-modernismo, mas uma derivação necessária de sermos animais dotados de cérebro.","171"
"F0044","O discurso público não é naturalmente direcionado à realidade, porque a sua própria característica é ser limitado e autorreferencial: fala de si mesmo e dos eventos imediatos, usando as ferramentas que o constituem. Não pode haver enraizamento no real sem que o seu círculo se expanda, o que só seria possível se ideias verdadeiras fossem mais “pegajosas” do que as ideias de esquerda — algo que exigiria sacrifício e, por isso, tende a ser evitado. Alguns filósofos compreenderam a autorreferencialidade, mas fixaram-se nos símbolos da linguagem. A realidade contém objetos, alguns animados, e ver é a melhor forma de navegar; esperar que os animais percecionem o mundo sem representação é incoerente. A complexidade humana deriva da experiência adaptativa: o ser humano é o animal de todos os nichos. Ver melhor o mundo — representar o mundo no cérebro de forma cada vez mais sofisticada — é uma necessidade ontológica imposta pelas condições ambientais de florescimento. O descrever vem depois do ver; historicamente, primeiro surge o objeto. Ainda que respostas emocionais de primeira ordem, adequadas a círculos próximos, tenham valor adaptativo, a sua verdade assenta sempre na realidade, nem que seja pelo seu fundamento biológico.","194"
"F0045","Este quadro permite propor frases verdadeiras sobre aquilo que não é o melhor modo de ser, aplicáveis a qualquer discussão ou dissenso. Os dissensos são, em geral, equívocos mútuos: não apenas sobre o que é dito ou ouvido, mas sobre o que se pensa estar em discussão, acrescidos de fatores primários que impedem a discussão de alguma vez ser verdadeira. Pensando em Camus, nos existencialistas e na alegoria de Sísifo, vê-se que essas respostas são dadas a um problema por eles próprios criado, resultante de um modo de análise limitado, incapaz de retirar valor do facto e de formular proposições verdadeiras sobre o significado da vida. Assim, recorre-se a ajustes comportamentais ou enquadramentos arbitrários do agir humano, como única direção justificável dentro do próprio absurdismo — o que é irrelevante. Mesmo que não se extraia valor do facto, o facto permanece, e é possível ver que estas posições não são verdadeiras: podem ter adequação literária ou funcionar em certos círculos, mas não produzem proposições verdadeiras. Se o fizessem, os modos de ser humanos seriam suicidas, exigindo racionalizar o não-matar-se. O mesmo se observa em pessimismos contemporâneos como o antinatalismo, que constroem justificações morais únicas a partir de enredos desadequados. Isto revela como o intelectualismo meramente formal — inteligente apenas no sentido corrente — produz excecionalismos falsos. Como todas as inteligências formais são colocadas em pé de igualdade no discurso académico e público, torna-se evidente a tendência de qualquer sistema que contenha seres humanos: assim que se institui uma “verdade”, constroem-se imediatamente sistemas formais em torno dela.","256"
"F0046","Os Estados Unidos constituem um exemplo singular: um grupo de homens concluiu que, para a melhor sociedade possível, bastam cerca de 14 artigos numa constituição. Isso explica terem-se tornado a melhor civilização alguma vez conhecida, potencialmente a única capaz de libertar a humanidade de catástrofes cósmicas como o colapso do Sol ou o impacto de um cometa. O contraste é visível na Europa, por exemplo em Portugal, cuja Constituição contém quase 300 artigos. Esta diferença exprime dois modos de ser distintos — os únicos dois modos fundamentais. Um esquece que o homem é; o outro lembra-se de que o homem é, no sentido ontológico do existir. Daí resulta um Estado que se limita a si próprio versus um Estado que existe para limitar o homem.","125"
"F0047","O panpsiquismo surge como um argumento absurdo que tenta afirmar que tudo é consciência apenas para evitar dizer que tudo é matéria. A contenda nasce de argumentos infantis na filosofia da mente, como o exemplo de imaginar um sujeito sem memória. Não ter memória é apenas não ter perduração experiencial; memória é a continuidade do ser após um evento. Se algo continua a existir depois de um acontecimento, tem memória. A diferença está apenas no grau de acesso, fineza e consciência dessa memória. O panpsiquismo tenta reduzir tudo a uma questão de complexidade, como se adicionar camadas transformasse algo qualitativamente noutro tipo de ser. Isto reflete um pós-modernismo aplicado à filosofia da mente: evita discutir o que é (matéria, homem, realidade) e limita-se a descrever processos e a formular proposições sobre eles. O homem é um animal biológico adaptativo, inserido num nicho que não reavalia continuamente as razões das suas crenças; estas persistem pela adequação à vida que permitem. Assim, o modo de ser do indivíduo reflete o modo de ser da sociedade. Apenas poucos dispõem-se a gastar energia a pensar e a destrinçar a verdade. O panpsiquismo prospera porque se ajusta ao estado pós-moderno centrado no processo e na forma, sendo uma variante do relativismo. No fundo, há apenas dois modos de ser fundamentais: a busca da verdade e a busca da forma/processo. O panpsiquismo é um travestismo filosófico que mascara esta divisão essencial.","235"
"F0048","Este padrão é observável em todos os níveis. Ao nível individual, qualquer comportamento ou conduta adotada — para com outro, consigo próprio ou com o meio — fica registado no corpo. Esse modo de ser existiu, logo existe, mesmo que não seja explícito para o próprio. A pessoa tende a continuar a revisitar esse modo de ser, não a revê-lo reflexivamente. A resposta normal é a preservação: preservar o ser e justificar o modo adotado através de enquadramentos que permitam manter a coerência interna, deslocando o “mau modo” para fora do eu. Isto parece abranger a maioria da população humana, por necessidade ontológica e biológica. O percurso humano — ter filhos, transmitir modos de ser, repetir padrões ao longo de centenas de milhares de anos — mostra esta continuidade. Surgem depois posições que elevam o processo a estatuto ontológico: a ideia de que, ao conhecer o processo, o homem se torna “deus do processo”, deixando de viver para ser vivido. Essas posições atribuem ao processo um estatuto superior ao que o permite, confundindo causa e condição. O discurso reduz-se a punch lines sobre como as coisas aparentam ser, escolhendo o processo como único horizonte existente. Isto conduz à crença de que o real é aquilo que se faz dele, que o ser é apenas o processo conhecido, e que o tempo e o caminho individual são exteriores à realidade — uma consequência inevitável da biologia humana e da tendência para substituir o real pelo processo. Daí a conclusão cultural de que “Deus morreu”.","253"
"F0049","A consciência é tratada como algo “especial” para ser elevada e separada do meio que a torna possível, esquecendo-se de que sensação, deteção simples, ouvir, ver e transformar vibrações em experiência são provas da sua naturalidade. A capacidade de reconstruir imageticamente objetos exteriores mostra o carácter natural da consciência; negar que animais veem apesar de terem olhos é absurdo. A emergência da consciência não exige mistificação: se existe um plano onde algo pode aparecer, então a aparição é necessária. A inteligência humana é uma forma natural que poderia, em princípio, surgir noutros seres vivos se as condições civilizacionais o permitissem, mas isso não implica qualquer teleologia do universo. O erro surge quando o discurso filosófico se afasta da lógica da realidade e se valida apenas por coerência interna. As crenças persistem porque o ser humano é biologicamente feito para se adaptar a círculos e nichos, não para os reavaliar continuamente. A filosofia da mente torna-se então excessivamente formal, compartimentalizada e autorreferencial, procurando refúgio em argumentos cada vez mais técnicos para evitar a ontologia. A consciência é confundida com substância, alma ou algo exterior à realidade, o que é absurdo. O discurso torna-se sábio apenas na aparência, pois sabedoria é adequação à realidade. Proposições verdadeiras são aquelas que melhor descrevem o real; o erro não é uma entidade, mas um modo de ser desadequado. No fim, todas as correlações entre meios e fins reconduzem à mesma questão: o ser.","238"
"F0050","A posição emotivista, tal como apresentada por Alex O’Connor, reduz proposições éticas a expressões emocionais ou comandos (“não faças isto”), negando-lhes qualquer estatuto de verdade. A ética seria apenas um subproduto do facto de o ser humano ser um animal emocional, sem relação com a verdade ou com a realidade. Este argumento incorre num erro categorial: trata a consciência como entidade autónoma separada da realidade e reduz a ética a mera expressão subjetiva. No entanto, a ética necessária — como a proposição “o homicídio é mau” — decorre da própria existência humana; sem ela, os modos de ser humanos tornar-se-iam inviáveis. A incapacidade de explicar tudo (na física, na cosmologia ou na consciência) não invalida a verdade das descrições parciais do real, pois todo o acesso ao real é necessariamente descritivo. A representação — sensorial, imagética, linguística — surge quando existem entidades capazes de receber sinais do exterior e de manter coerências da realidade na memória. A complexidade humana resulta da capacidade de representar não apenas objetos isolados, mas cadeias de relações no tempo e no movimento, possibilitando imaginação e criatividade. Negar a verdade de proposições éticas conduz ao relativismo, que acaba por minar até verdades científicas. Embora os modos de ser humanos sejam influenciados por emoções e círculos locais, o real não se limita a essas propriedades emergentes; estas propagam-se apenas porque a estrutura da realidade o permite.","229"
"F0051","O acesso ao real — universo, física, homem, consciência e campo das possibilidades — contém necessariamente o bom e o errado, o certo e o verdadeiro. O erro surge quando estes planos são tratados como substâncias ou realidades distintas, em vez de círculos integrados no real. A consciência não é uma coisa, mas uma relação; tal como um pontapé não está “dentro” da perna, a relação não está contida nos seus termos. A representação é, por definição, uma relação, e é isso que a consciência é. Todo o conhecimento humano — a filosofia no sentido próprio, enquanto saber sábio — visa a unificação progressiva da descrição do real. O homem, enquanto ser histórico, acrescenta modos de ser: da deteção à representação, da adaptação biológica à transmissão de arquétipos, genes e comportamentos. A passagem de ideias através de memes e arquétipos encarna modos de ser e unifica o pensamento filosófico. A verdade é apenas o nome dado ao que é real; um modo de ser verdadeiro é aquele que se comporta de acordo com a realidade. Proposições valorativas verdadeiras são sempre possíveis porque o dever-ser está limitado pelo poder-ser. Existem apenas dois modos fundamentais: o modo verdadeiro e todos os outros. Os modos não verdadeiros prevalecem por adaptação energética e preservação de crenças. Em sociedades de larga escala, modos comportamentais próprios de círculos pequenos tendem a dominar os círculos maiores. A filosofia que se fixa apenas no processo e na forma, retirando o real da equação, torna-se autorreferencial. Mesmo génios como Wittgenstein, embora tenham revelado verdades sobre o jogo da linguagem, falharam em reconhecer o plano real onde esse jogo se manifesta.","271"
"F0052","Preferir não ser racional equivale a preferir que a espécie humana nunca se tivesse desenvolvido. Dadas as características biológicas e ambientais que permitiram a emergência da consciência, a racionalidade era inevitável; mesmo que se desejasse que a consciência não tivesse surgido, ela surgiria. Apreender é distinto de pensar: apreende-se objetos, mas pensa-se sobre pensamentos. Pensar sobre um cão não é pensar sobre o cão visto por outro, mas isso não nega nem afirma a existência do cão; apenas mostra que toda a apreensão humana é mediada por estarmos inseridos no real. Toda a afirmação é, em última instância, sobre o real. O erro está em tratar o real como algo externo a nós. É da própria existência que se extrai a necessidade ontológica: saber que existimos no real implica saber que agir contra o real é mau. Para saber o que é bom, é necessário descrever corretamente o real, incluindo o campo das possibilidades. Dentro do poder-ser, agir a favor da realidade é bom, não apenas no plano descritivo, mas também no plano valorativo.","174"
"F0053","O ser, seja quem for, se existe, existe dentro do que lhe possibilita existir. Conhecer o real implica agir dentro dos seus limites: não se constrói uma casa com o telhado por baixo das paredes. O real é o que é, e o homem torna-o reconhecido, não apenas detetado como pelos outros animais. Vivendo no campo das possibilidades, qualquer proposição pode ser medida relativamente ao real, que é aquilo que permite o florescimento. A evolução humana prova isso: não foi pela estagnação, mas pela exploração, socialização e integração do real. A representação imagética — como a do tigre — permite antecipação e adaptação. Os arquétipos nascem dessa capacidade representacional e emocional, que no humano se desenvolve de forma ética e imagética avançada. A consciência emerge da capacidade de representação manipulável e comunicável, intensificada pela vida social. A ação livre existe dentro de um modo de ser inserido no real, sempre com referência a ele. O comportamento emocional é o mais adequado aos círculos menores onde a humanidade se formou, mas torna-se inadequado quando aplicado a círculos maiores, como civilizações, por não corresponder ao modo de ser exigido por esses níveis do real.","192"
"F0054","A fala surge como resposta à existência de estados mentais partilháveis entre indivíduos que se reconhecem como semelhantes. A linguagem aparece como meio necessário para expressar estados mentais num contexto social. A diversidade linguística deriva dos diferentes modos de ser e civilizações que os propagam. O homem, ao conhecer um sistema, tende a exprimi-lo até à exaustão, intelectualizando-o ao limite, retirando-lhe todo o “suco”. Essa tendência leva à autonomização da linguagem enquanto meio, tentando-se retirar qualquer significado real que não seja o próprio sistema linguístico. Quando se separa linguagem e objeto — quando o discurso deixa de referir o real — todo o sistema de crenças passa a operar apenas dentro do próprio discurso. Nesse contexto, torna-se impossível dizer o que é melhor, correto ou errado, não por impossibilidade ontológica, mas porque se removeu o plano onde o sistema existe: o real.","142"
"F0055","Argumento sobre livre-arbítrio: ou tudo é determinado, ou é aleatório/sem causa; em ambos os casos, conclui-se que não há livre-arbítrio. A crítica a este enquadramento é que ele omite a distinção entre possibilidade e atualidade no plano da ação deliberada. A deliberação é possível porque há acesso representacional reflexivo à realidade; a pergunta “o que nos leva a deliberar?” responde-se pelo que permite deliberar: a estrutura representacional consciente. A liberdade humana situa-se no campo de possibilidades próprio do ser humano: ao contrário de uma pedra, cujo movimento está estritamente subordinado ao decurso físico sem interioridade, o humano opera num campo de possibilidades que não se reduz a eventos naturais imediatos. Expandir o livre-arbítrio para fora do círculo de possibilidades próprio de um animal consciente é erro categorial. A vida comum fornece prova prática dessa liberdade: conduzir um automóvel envolve múltiplas decisões integradas (perceção, regras, antecipação, controle motor), baseadas em representações e ajustamentos contínuos. Reduzir isto a mecanicismo e concluir que a consciência “não existe” ignora que somos animais e que nenhum outro animal executa esse nível de coordenação representacional deliberada. A moldagem de representações não é explicável como simples mecânica sem um ponto de vista reflexivo, ainda que coexistente com processos automáticos dentro do real. Os círculos do real não são todos o mesmo círculo: o corpo permite reflexão sem que isso implique operar no nível físico fundamental. O bem está implicado em toda a vida prática: cozinhar, cortar, afiar, requer conhecer o real e agir conforme ele. O “bom” e o “aquém” emergem desde a estrutura basal dos factos. Isto é tautológico: um objeto dentro do real que tenta conhecer o real tem de confrontar-se com o real.","279"
"F0056","A orientação ao real não requer esforço super-humano: ser bom pai implica simplesmente sê-lo, não abandonar o filho sem o arquétipo permanente do pai. Quer essa orientação resulte de mecanicidade do ser, de pensamento deliberativo ou de ação voluntária com livre-arbítrio é irrelevante; o critério é sempre o real. A diferença é apenas entre o implícito e o explícito. O custo energético do pensamento reflexivo faz com que a tendência natural seja a primazia da emoção, o que confirma a adequação evolutiva do homem enquanto animal inserido no real. As características humanas evoluem dentro do real, como mostram adaptações biológicas locais (ex.: populações humanas com maior capacidade de retenção de oxigénio em certos contextos ambientais). Cada grupo humano adapta-se ao seu círculo de realidade, e isso é bom porque é conforme ao real vivido. Se a vida é relacional, então a verdade depende sempre da estrutura da relação. O erro grave do pensamento supostamente sábio é transformar o termo, a linguagem ou a forma intelectualizada na totalidade da análise, desligando-a da fundação real. Há apenas dois modos fundamentais de ser: o que esquece que pisa a terra para andar, e o que acha que o problema está nos sapatos.","199"
