"id","texto","palavras"
"F0001","O que é que tem de haver alguma coisa fundacional nos dois grandes grupos de pessoas, pelo menos de pessoas que vivam na nossa cultura ocidental? Mas tem de haver algo positivo entre a esquerda e a direita, no grande grupo, mas mais concretamente, ao nível psicológico, nos traços de personalidade, que refletem respostas diferentes, que não refletem mesmo tipos de personalidade diferentes, ou seja, refletem mesmo pessoas diferentes. Se fala em diferentes tipos de personalidade, fala simplesmente em pessoas completamente diferentes. Como todos somos nós, como nós somos todos. Nesse tipo de comportamento, consegue-se inferir o tipo de pensamento, os padrões de atividade mental consciente, mas também refletidos no sentido do comportamento, ainda que automático, animalístico, meramente mecanizado pelas cadências lógicas necessárias de evolução.","125"
"F0002","Mas a questão não era tanto o plano grande, era mais o plano pequeno, era mais outro, era como, era mais este, era como se as minhas crenças, e crenças aqui em Portugal é muito amplo, não é? Crenças rapidamente destruídas e supostas e maltratadas e... Mas também crenças, não sei, muitas crenças internacionais, mas também crenças... Mas é o tipo de crença que se tem, crenças que se têm sobre os problemas socialmente falados ou tidos em consideração, então o tipo de abordagem para a realidade, para o ser e o dever ser, para a realidade e o... a realidade, ou seja, o problema e o plano da solução, ou seja, o que deveria ser, essa abordagem vai ser necessariamente diferente. Logo, aplicado esse tipo de pessoa à obrigatoriedade de existir num plano real e complexo com objetos exteriores a nós e também com os nossos obstáculos de consciência e consciência dos outros, isto vai fazer com que se ramifique necessariamente.","162"
"F0003","Lembrei-me. Ah, lembrei-me. Não, não, não. A questão é sobre a necessidade de haver dois indicadores obrigatórios ontológicos, não é? Que são, portanto, deixa cá ver, deixa cá ver, deixa cá ver, a realidade, não é? Os objetos, todos os objetos e as relações que compõem a realidade. E a nossa capacidade de criar mudança, boa ou má, no mundo. Estes são planos obrigatórios, que existem, independentemente do que é que se diga em qualquer sistema que tenha que conter objetos, mas a dispersão comportamental, não é? Quando a possibilidade é tanta e existem as variedades, portanto, em grupo, de tipos comportamentais, também se torna-se obrigatório instaurar logo aí também um ponto ontológico obrigatório, que é uma divisão. Devemos ainda não saber o que é, mas obrigatoriamente, obrigatoriamente, há aí uma divisão, ou seja, um caminho para a esquerda, um caminho para a direita, que se torna obrigatório. Isso significa que... Isso significa que... Isso significa que... Ou seja, isso...","160"
"F0004","Sim, construindo de baixo para cima, ao nível das entidades e das propriedades e das relações. Isto tem significativo moral, porque em princípio, em princípio não, porque a divergência do comportamento real, a divergência do comportamento que descreve de maneira mais completa e integral aquilo que é, no fundo que é a conformação do objeto com o seu conhecimento, portanto a verdade, quando o comportamento, quando o valor é junto à verdade, ainda dentro dos limites da verdade do que é e daquilo que pode ser, porque o que devia ser está contigo e pode ser, quando este comportamento... Ah, sim, este comportamento existe, há uma necessidade para este tipo de comportamento. Este comportamento existe porque em relações sociais de pequena escala são necessárias, são necessárias, não sem ter nada a ver com a questão da verdade, meramente pela questão da necessidade de continuação de ambientes internos e externos homeostásicos, ou como é que se diz, não é? De forma cultural, biológica e de seguida auto-preservação.","166"
"F0005","Mas, como é óbvio, nem todos os tipos de outro comportamento que não são deste comportamento se comportam de acordo com a verdade, como é óbvio. Têm raiva, são agressivos, não pensam, tudo o que se queira fazer. E é muitas vezes necessário, para chamar à calma o animal, não a razão, mas a emoção. Tudo tem o seu papel, e esse papel é muito importante. Mas, o problema é que, em larga escala, os critérios de emoção, ou seja, os critérios não verdadeiros, não verdadeiros, mas úteis, de certo modo, esses não são necessários. Aliás, até são dispensáveis. E, em larga escala, também se pode incluir relações a... isso aí já vou...","113"
"F0006","Há uma necessidade moral, não há uma necessidade moral, há uma necessidade imposta pelos próprios objetos do sistema de baixo para cima, de baixo para cima, há uma necessidade em que o ser humano, por ser social e por todos os objetos, entidades e relações incluindo a parte social do ser humano, são úteis. Esses comportamentos são úteis. Então esses modos de pensar, esses modos de atividade mental..E por isso existem, porque são úteis. Está tudo certo. A questão... E tem a sua razão de ser, dentro dos mini-sistemas em que se incluem. Como, é obvio, como relações familiares, relações de amizade, relações de trabalho meio-meio. Mas... em qualquer sistema vai sempre haver a pessoa que vai ter a resposta para o problema que descreve... vírgula. Oh, é muito problema. Que descreve mal. E por isso aplica mal a solução.","140"
"F0007","Vai sempre haver esse comportamento como necessidade do próprio sistema, e... E, pelo... por tudo, não é? Por tudo. O problema torna-se... ...quando esse tipo de comportamento é dominante. Porque quando esse tipo de comportamento, ou seja, esse tipo de pessoa... pode ser qualquer tipo de personalidade... A questão é quando esse tipo se torna o tipo. Neste caso da esquerda, o tipo que bifurca para a estrada da esquerda se torna dominante. Porquê? Porque, como dizia Jung, pensar é difícil. Por isso é que a maior parte das pessoas julgam. E quando esse tipo se torna dominante, domina quase totalmente só pelo simples facto de requerer menos esforço, como justificação de modo de existir, de viver, do que um que nos obrigue a destar energia.","126"
"F0008","Não. Não, a questão é... Pronto. O grande tema aqui é a minha... Que eu acho que a única maneira de poder fazer qualquer tipo de afirmação valorativa útil... Vamos ver o que nós fizemos. Não entendo nem se esse assunto é palavra certa, mas alguma que seja... Alguma que seja... Qualquer uma, até. Não podemos ser ridículos e podemos dizer qualquer uma. Qualquer proposição valorativa, para nós aferirmos da sua bondade, temos de, primeiro, aferir da verdade do problema descrito e da solução proposta. Porque o valor está incluído no real. E... E o valor, como neste caso da discussão, o valor nasce... Não nasce. Não sei se nasce, mas o valor... Pelo menos os diferentes... Os valores biológicos. Aquilo que se transformam em mimos do docking. Os valores biológicos, não é? Os valores biológicos, esses também são importantes. Esses, tanto o valor consequente, é mais assim, o valor consequente tem impacto, tem, tem, existe. Existe de maneira moldada pela estrutura que está inserida naquelas entidades biológicas mínimas, mas também pelo modo de abordar a realidade dos humanos. E, como tudo existe no plano do discurso, da descrição, porque é assim que nós entendemos o mundo, falamos com o mundo, e deixamos o mundo falar connosco. Muito isto é o problema. Como nós operamos nesse caminho, quanto mais pessoas, ou quanto mais tipo de discurso ligado ao tipo de pessoa, no fundo qualquer tipo de discurso é sempre ligado a qualquer tipo de modo de existir, de pensar, de modo de ser. Qualquer ideia revela sempre uma atividade qualquer mental que a pessoa tenha tido.","266"
"F0009","Ou que tenha contaminado o resto da cultura com essas ideias. Tudo é um bocado a mesma coisa. Mas... Quanto mais do tipo da esquerda, mais a verdade vai ser abafada. Porque a verdade... Porque para alguém ser do tipo verdade, tem de ter tipos de pensamento recorrentes, pelo menos. Ou então de comportamentos inactos. Não é? Para... Para, para, para, para... Para compreender a realidade em que está inserido, compreender o exterior e compreender o interior a um nível mínimo. Chega-se lá através de várias maneiras. Cristianismo é uma delas. Qualquer sistema de crenças que tenha como uma das crenças principais ou importantes ou pelo menos consequentes nas outras crenças um modo de verdade. Há de ser sempre a colocação da realidade na realidade e do indivíduo no indivíduo. Portanto, a colocação da necessidade de mudança, não na realidade, mas sim no indivíduo. Porque isto, depois, por necessidade lógica de coerência e harmónica, leva à ação modificadora. Não só descoberta daquilo que é, compreensão daquilo que é, mas também aplicação do valor na medida em que vai trazer um melhor estado de coisas. Ou pelo menos à preservação, à preservação do estado de coisas. Portanto, o que é que eu estava a dizer? Ser deste tipo de pessoa, contrariamente a outro tipo de pessoa, que encontre uma qualquer justificação que seja minimamente apresentável pela mente que não envolva nenhum tipo de autoresponsabilidade. São questões básicas, questões elementares do comportamento humano, variados. Pela simples querer preservar a energia e preferir não fazer nada, a fazer algo. E depois, quando confrontado com a realidade e com os milhões...","267"
"F0010","E com os milhões de exemplos que existem, e com os milhões de exemplos que se deparam sobre a pessoa, sobre qual seria o caminho correto a seguir, se o cérebro fosse usado, a resposta natural a isso, à evidência do erro, resposta natural à evidência do erro... O que é que eu queria dizer? Não é raramente, raramente recai, raramente se transforma em algo como... Epá, espera aí. Se calhar eu tenho de mudar. Pela necessidade do próprio sistema que está inserido? Como de facto essa seria a resposta óbvia, não é? Porque evidente e verdadeira. Não sei... Verdade no sentido de... A verdade é sempre uma auto-evidência. No sentido de que é mais verdade, tanto quanto melhor for a sua descrição, a descrição da realidade. É a verdade. A verdade é, portanto, como se a realidade fosse um labirinto integrado a ser construído de baixo para cima. Se isso é a realidade, parece-me, pelo menos algo em que outras coisas existem. Parece-me, pelo menos... Pelo menos não, isto é verdade. Porque para existir tem de ser assim. Se não existir... Mas a verdade é apenas um nome que se dá... ...que se dá ao quadro onde o labirinto está a ser construído, e que, com a ajuda da consciência, porque é a consciência que descobre o trabalho. ...a mudar o seu sentido cada vez que se olha para o mapa. E é verdade em todo o sentido. É verdade aplicada a tudo, portanto, o prédio, o que é que um prédio existe? Qual é a verdade sobre o prédio? É a boa descrição do que o prédio contém, das relações que existem no prédio, das alterações, das modificações, daquilo que existe, daquilo que existe e que acontece, e que está em movimento e em interação.","297"
"F0011","A própria lei é também um exemplo porque, como manifestações não de consenso, manifestações de descrição de realidade no fundo, que é o que toda a teoria do direito é. Dizer, as sociedades comportam-se assim, o homem comporta-se assim, mas como o melhor resultado seria este, então a norma será esta. O homem tende a comercializar, logo vamos positivar o direito, vamos positivar a relação jurídica do contrato. Comprevendo, por exemplo. Mas aplicando-se a tudo, como é óbvio. E é aqui que também... E também... Isto é a prova de que qualquer sistema ético... Qualquer sistema? Nem é ético, porque é sistema universal apoiando toda a realidade. Qualquer sistema aplicado à pergunta qual é o melhor modo de ser, de viver e tudo, qual é o melhor modo de ser, tem de conter obrigatoriamente a integralidade, a melhor precisa. A melhor precisa descrição, integral descrição do que é, vamos chamar-lhe de problema, por exemplo, para que a proposição sobre o que devia ser, o campo do que devia ser, quer ser admissível. Quanto mais verdadeiro ou mais probabilisticamente verdadeiro possível. Mas neste caso é probabilisticamente porque é verdadeiro, porque é uma publicação de verdade. As proposições valorativas que propõem o melhor, quando o melhor é o próprio estado de coisas a florescer, então são verdadeiras. Portanto, o homem, ao criar a lei, é a própria entidade do sistema a fazer aquilo que deve ser feito, que é ampliar o nível de descrição de realidade a descrição verdadeira, como é óbvio para melhor poder aplicar a solução. E não é só, ai, a solução é uma lei. Não, não, não. Que tipo de lei? Com que alcance? Com que conteúdos? Incidindo sobre o quê, em concreto? Procurando estabelecer, repor, manter o quê? Portanto, posso dizer que todo o relativismo só existe numa microanálise. Ele só existe, só é relevante numa microanálise. O relativismo, ou seja, a deshierarquicação da verdade para elevar a emoção a vencer por questões meramente biológicas e sociais de pequenas comunidades, somente. E o nível de análise sobre razões de melhores modos de ser em sociedades não estão nesse patamar. Porque o próprio sistema também inclui a necessidade de, para que micro-sistemas se manterem coesos, haver preferências de respostas que afastam, por exemplo, a lógica puramente ontológica, mas que beneficiam verdades animalescas, verdades de idiosincrasia do homem que é necessário manter para a estabilidade, depois, das macro-relações. E, portanto, pode-se dizer que, então, as únicas respostas verdadeiras que podem ser apresentadas para a pergunta de qual o melhor modo de viver, em sociedades alheias dos humanos, como é óbvio, essa proposta, as respostas têm de estar sempre, sempre, sempre, sempre, sempre, sempre limitadas à verdade, incluindo compreender os seus mini-ecossistemas. Mas, para respostas de larga escala, para respostas de larga escala, em que civilizações se misturam com objetos exteriores e com elas próprias,","475"
"F0012","Que não é adequado usar tudo o que não seja a melhor descrição possível da realidade. E porque se for logo, ontologicamente, ao nível dos tracinhos no mapa da cadeia da realidade, fecha o círculo, fecha o mapa, a todos os caminhos, a todos os caminhos, a todos os caminhos, intelectualmente... como é que se diz? Caldões. A questão não era essa. A questão é que a crítica maior é dirigida aos sistemas de pensamento, ou seja, aos tipos de pensamento que as pessoas têm nas suas cabeças e que depois exteriorizem comportamentos. A crítica é aos sistemas dominantes do discurso cultural e, entre aspas, científico-académico. Em grandes aspas. Não, não é nada disso. Não se disfarçam como... Portanto, as crenças bifurcadas num lado de relegar para o lado a única solução possível para resolver qualquer problema de sociedade, que é melhor descrever o problema para melhor aplicar a solução que tem que estar contida na própria descrição da realidade, relegar para o lado isto e favorecer outros tipos de pensamentos mais de primeira ordem, mais instintivos, mais emocionais, ou seja, respostas biológicas que não eram para problemas dessa larga escala. Mas quando esse tipo de pensamento se torna dominante na cultura, aquela proliferação deste tipo de visões que são muito mais captáveis pelo cérebro do que outras que requerem esforço físico... A crítica é que isto também é uma própria dependência do sistema ontológico, porque a própria realidade que contém nela própria, se contém o homem com uma bifurcação natural para saber, com uma bifurcação natural para aplicar estilos de resposta aos problemas, para aplicar dois diferentes grandes estilos de resposta aos problemas da realidade. Um que é procurar a realidade e mudar-se, mudar-se, melhorar-se, para melhor adaptar-se à realidade e melhor trazer sistemas... É mais institutiva como, há um problema, então eu vou é mudar o problema, eu vou é mudar o sistema para criar um deve-ser, quem vive na cabeça do deve-ser. A crítica é essa, é que o próprio sistema contém essa necessidade de que esta visão, a visão do lado mais básico, quando toma conta do discurso social, quando toma conta do discurso social, adapta-o.","360"
"F0013","Outro exemplo. O exemplo da tributação. O exemplo da tributação, no seu âmago, é uma análise e resposta ao problema de qual é o melhor modo de nos coordenarmos a todos, tendo como modo de análise a necessidade de, para corrigir, ou para corrigir não, porque inicialmente não foi para corrigir, agora a correção é só a justificação moderna para algo já implantado há muito tempo e cuja justificação era para alimentar os devaneios dos chefes de estados ou então necessidades militares. Tudo isso prende-se com existe um problema, então eu vou atuar mudando o sistema para melhor beneficiar, criando depois todo um conjunto de externalidades durante centenas e centenas de anos que completamente distorcem a única resposta possível. Um dos princípios básicos para a resposta do problema que será que é o homem que cria o sistema, não é o sistema que cria o homem. Olhando de uma perspectiva milenar, olhando de fora, vendo a sociedade unveiling itself, não sei como é que se diz em português. E tendo isso em conta, as ideias que se vão tendo, e que se vão disseminando e moldando a cultura, são, foram, levaram a que com o relativismo... Não. A primeira fase era no sentido de que, do ponto de vista da perceção, da maneira como o homem obtém conhecimento, do ponto de vista da perceção, é o modo mais adaptavelmente colante, tipo cola, que os humanos apreendem como crença naturalmente, pois está ligado a todos os tipos de pessoas, aos diferentes tipos de personalidade que cada pessoa tem e é. Porque uma crença dessa natureza tem de vir do relativismo. Mas o relativismo também no sentido de... pronto, no sentido de crença coletiva. Que depois, nos séculos mais recentes, se transformou no quê? Se mascarou, se mascarou, se mascarou com uma forma científica, entre aspas, mas que é apenas um modo de dissipação, que é o melhor, que é o melhor, porquê? Porque traz consigo a presunção falsa, a presunção falsa de verdade. Que é das universidades, e dos antigos científicos, e dos especialistas intelectuais todos.","345"
"F0014","E a forma do discurso, portanto, a forma do modo de ser, melhor do que isso, não é só do discurso, é a forma do modo de ser, é algo que nós conseguimos apreender relativamente rápido e sem muito esforço mental. Requer um pouco mais quando se cria ativamente ter um tipo de discurso, porque o tipo de discurso aí já é diferente do simples modo de ser, o modo de aparentar, o modo de comportar, rotinamente. O tipo de discurso, então, em português, pelo seu tipo de língua, muito precisa, muito pouco dada a ideias gerais e mais a descrições, leva a que o tipo de forma seja... Ou seja, que se pretenda ter um tipo de forma tal que se pareça que o que se diz é a verdade e o bem, que é a mesma coisa, porque tem a forma intelectual. E a forma da transmissão do conhecimento tem essa característica de apreensão inapta. Há mais formas com mais aptidão para essa apreensão inapta do que outras, e esta tende a ser a pretensa forma verdadeira, ou seja, escudando-se na forma da verdade, só que com o conteúdo, como é óbvio, falso, e por isso falso também. A consequência é o quê? É a disseminação de ideias falsas aparentemente verdadeiras. [...] O melhor modo de ser tem que ser pelas próprias características ontológicas do sistema. [...] Tem que ser um que seja direcionado à verdade, porque não é só o descritivamente correto como é o que leva a planos de devir verdadeiros. [...] O farol da verdade, quando é percecionado largamente, especialmente por quem tem capacidade de disseminar ideias, quando é direcionado de uma forma aparentemente verdadeira, formalmente verdadeira, mas com conteúdo falso, gera crenças coletivas falsas. [...] O problema central é a negação do indivíduo como base ontológica, a delegação do indivíduo a uma instância coletiva ou subjetiva que se pretende superior à realidade. [...] Leva à crença de que o que eu acho vale mais do que o que a realidade é. Portanto, se eu acho isto, é o real. Tanto é o bom, que é a mesma coisa.","354"
"F0015","E... isto tinha a ver com o quê? Não sei, eram mais ideias. Eram as ideias que vivem por aí, que existem ao redor das sociedades, e que, como também uma evidência natural, como a necessidade do próprio sistema, a necessidade de nós estarmos incluídos neste próprio sistema libertanista, algo assim desse género, é que dá espaço à equivalência, pela questão da forma e pela questão do modo de ser, dá-lhe uma equivalência ao subjetivismo e ao realismo. Não sei agora como é que, mais fundo ainda, mais básico eu consigo ir. Agora eu já não sei onde é que eu ia, tem que ver, mas eu creio que isto tudo começou com uma ideia sobre... Com uma ideia sobre... Claro, era depois sobre como é óbvio os efeitos nefastos que toda esta realidade tem. Que é... Pronto, já já já disse um, com a abertura do mercado de trabalho das mulheres. Não que não fosse algo também que fosse necessário do próprio sistema, mas... Apenas apontando os efeitos da dissipação de crenças erradas. Erradas, tanto no sentido descritivo como do plano futuro. Mas era como se fosse... É do género. Se na sociedade o homem é livre. É livre para trocar coisas. Criar coisas. Relacionar-se com outras pessoas. Exigir coisas de outras pessoas em retorno de outras coisas. Voluntariamente. Entrar em acordos. Qualquer tipo de desejo. Inovar. Recriar. Destruir o criado. O que cada criou. Para fazer melhor. Se este é o sistema existente, e é dos melhores sistemas, a abertura do mercado às mulheres leva à duplicação da mão-de-obra, à capacidade de se empregar mais facilmente, maior poder negocial de quem emprega, de quem constrói, e mais precisamente, de quem detém poder e relevo no setor. Porque o que existe no mercado é... Porque o mercado é um tipo de sociedade. Por si só, tem pessoas que operam nele, que não são as mesmas pessoas que operam na vida, no resto da vida, ou podem ser, conflituam, convergem, nem sempre. Mas nele nascem significâncias ontológicas, dele nascem efeitos e causas na sociedade e no homem. É um plano, é um plano à parte. Em que operando bem, tudo bem. Se for verdadeiro, se não for, como tudo, não. Não tenho nem ideia da questão, mas a questão não era essa, a questão não era essa. Isto era agora, isto é um dos milhões de apartes.","397"
"F0016","Ah, a questão era da necessidade. A questão era da necessidade de, obviamente, que o valor do trabalho, no fundo, o valor da vida do homem, o valor do tempo que dá e do gasto e do sacrifício que faz, o valor da vida do homem, vai ser menor. Vai ser menor, vai ser infinitamente menor. Não sendo mau nem bom. No sentido de ser mau, apenas. Não é bom. Não, tem que ser mau, como eu ouço. Tem que ser mau. Tem que ser mau. Pelo menos desta forma. Desta forma em que delega, em benefício do trabalho, a função natural da sobrevivência da espécie que recai sobre a mulher. E, quer dizer, se é para ser o conhecedor da estrutura e, por isso, advocador dos exercícios físicos, e, por isso, advocar as soluções falsas, porque não se é conhecedor, colocas as soluções ao tempo de aula. Mas se é para ter esta força, se é para ter a forma de quem conhece a estrutura, que é uma forma linda na percepção de uma verdade, de uma realidade. Só aí é que a estética vai estar incluída na perfeição filosófica do ser. Porque este modo de ser, sem o ser assim, é risível, porque não é autêntico no sentido de não encarnar a necessidade descritiva para a aplicação valorativa. Porque o ser faz parte do real. Portanto, além das constituições que isso obriga, sendo um ser consciente, sendo um ser com consciência e com capacidade de agir livremente, de construir, de moldar, de destruir, de reconstruir... Então, sobre ele recai quase que uma necessidade de ser derivada da própria realidade. Se eu estou a conduzir, eu sei que tenho de manter-me a uma grande velocidade, com controle longo, duradouro, sobre o carro, de caminho volante e assim por diante. E ser algo diferente é, pelo seu efeito imediato, imediatamente, também salvo pelo enasmo, tido como errado, absurdo, estúpido. Mas a aplicação do... O desvelar, o desvendar, o abrir da cortina dos efeitos de modo de ser falsos é mais lenta, não é duradoura, é mais lenta, não é? Demora tempo. Porque é a necessidade biológica de sermos um animal que leva às consequências inevitáveis da estruturação. Quanto mais afastada da verdade está, mais errada está, mais falsa está. A cadência da evolução das ideias filosóficas e científicas, que são as únicas que me interessam. E científicas são filosóficas. Porque filosofia é o modo de ser de apreensão da realidade. Portanto, quer dizer, está tudo um bocado nesse aspecto adentro da filosofia. Pronto, e o ponto era que a cadência que existe de se ver, a cadência histórica da evolução das ideias filosóficas, é o guião para a compreensão da realidade. Porque é sobre elas que culmina a evidência, as evidências que eu ando aqui a dizer.","467"
