fragment_id,origem_id,ordem_no_ficheiro,ficheiro_origem,data_origem,header_original,texto_fragmento,texto_normalizado,n_chars_fragmento,paragrafos_agregados,frases_aproximadas,densidade_aprox,tipo_material_fonte,tipo_unidade_segmentacao,criterio_de_unidade,houve_fusao_de_paragrafos,houve_corte_interno,container_tipo_segmentacao,funcao_textual_dominante,tema_dominante_provisorio,conceitos_relevantes_provisorios,integridade_semantica_grau,confianca_segmentacao,fragmento_anterior,fragmento_seguinte,continua_anterior,prepara_seguinte_segmentacao,estado_revisao_segmentacao,pronto_para_extrator_cadencia,requer_revisao_manual_prioritaria_segmentacao,modelo_segmentador,versao_segmentador,timestamp_segmentador,funcao_cadencia_principal,funcao_cadencia_secundaria,direcao_movimento,grau_de_abertura_argumentativa,centralidade,estatuto_no_percurso,zona_provavel_percurso,ponte_entre_zonas,prepara_fragmento_seguinte_cadencia,fecha_algo_anterior,incide_sobre_erro,familia_erro_provavel,erro_dominante_provavel,dominio_contributivo_principal,tipo_fragmento_provavel,aproveitamento_editorial,necessita_revisao_humana,confianca_cadencia,justificacao_curta_cadencia,prioridade_revisao,hipotese_de_trabalho,zona_revista_manualmente,funcao_revista_manualmente,prioridade_falso_negativo,zona_sugerida_manual,grau_de_conviccao_manual,motivo_da_reclassificacao,decisao_editorial_manual,notas_revisor
F0002_SEG_001,F0002,2,fragmentos.md,2026-01-02,## F0002 — 2026-01-02,"Mas a questão não era tanto o plano grande, era mais o plano pequeno, era mais outro, era como, era mais este, era como se as minhas crenças, e crenças aqui em Portugal é muito amplo, não é? Crenças rapidamente destruídas e supostas e maltratadas e... Mas também crenças, não sei, muitas crenças internacionais, mas também crenças... Mas é o tipo de crença que se tem, crenças que se têm sobre os problemas socialmente falados ou tidos em consideração, então o tipo de abordagem para a realidade, para o ser e o dever ser, para a realidade e o... a realidade, ou seja, o problema e o plano da solução, ou seja, o que deveria ser, essa abordagem vai ser necessariamente diferente. Logo, aplicado esse tipo de pessoa à obrigatoriedade de existir num plano real e complexo com objetos exteriores a nós e também com os nossos obstáculos de consciência e consciência dos outros, isto vai fazer com que se ramifique necessariamente.","Mas a questão não era tanto o plano grande, era mais o plano pequeno, era mais outro, era como, era mais este, era como se as minhas crenças, e crenças aqui em Portugal é muito amplo, não é? Crenças rapidamente destruídas e supostas e maltratadas e... Mas também crenças, não sei, muitas crenças internacionais, mas também crenças... Mas é o tipo de crença que se tem, crenças que se têm sobre os problemas socialmente falados ou tidos em consideração, então o tipo de abordagem para a realidade, para o ser e o dever ser, para a realidade e o... a realidade, ou seja, o problema e o plano da solução, ou seja, o que deveria ser, essa abordagem vai ser necessariamente diferente. Logo, aplicado esse tipo de pessoa à obrigatoriedade de existir num plano real e complexo com objetos exteriores a nós e também com os nossos obstáculos de consciência e consciência dos outros, isto vai fazer com que se ramifique necessariamente.",926,1,6,alta,misto,sequencia_argumentativa,continuidade_argumentativa,False,False,segmentacao_semantica_duas_fases,exploracao,"crenças, abordagem, complexidade, ramificação",crenças | abordagem | realidade | complexidade | ramificação,alto,alta,,,False,False,segmentado_auto,True,False,models/gemini-2.5-flash,resegmentador_semantico_v4_1_duas_fases,2026-03-11 01:06:00,formulacao_inicial,,introduz,introducao,auxiliar,solto_ainda_sem_encaixe,indefinida,False,False,False,False,nao_aplicavel,,epistemologia,,material_a_retrabalhar,True,baixa,"O texto ensaia uma formulação sobre crenças e modos de abordagem à realidade, mas permanece hesitante e sem ancoragem estrutural suficiente para fixar zona; a leitura mais prudente é epistemológica, porém solta e a rever.",1,,,,1,,,,,
F0004_SEG_001,F0004,4,fragmentos.md,2026-01-02,## F0004 — 2026-01-02,"Sim, construindo de baixo para cima, ao nível das entidades e das propriedades e das relações. Isto tem significativo moral, porque em princípio, em princípio não, porque a divergência do comportamento real, a divergência do comportamento que descreve de maneira mais completa e integral aquilo que é, no fundo que é a conformação do objeto com o seu conhecimento, portanto a verdade, quando o comportamento, quando o valor é junto à verdade, ainda dentro dos limites da verdade do que é e daquilo que pode ser, porque o que devia ser está contigo e pode ser, quando este comportamento... Ah, sim, este comportamento existe, há uma necessidade para este tipo de comportamento. Este comportamento existe porque em relações sociais de pequena escala são necessárias, são necessárias, não sem ter nada a ver com a questão da verdade, meramente pela questão da necessidade de continuação de ambientes internos e externos homeostásicos, ou como é que se diz, não é? De forma cultural, biológica e de seguida auto-preservação.","Sim, construindo de baixo para cima, ao nível das entidades e das propriedades e das relações. Isto tem significativo moral, porque em princípio, em princípio não, porque a divergência do comportamento real, a divergência do comportamento que descreve de maneira mais completa e integral aquilo que é, no fundo que é a conformação do objeto com o seu conhecimento, portanto a verdade, quando o comportamento, quando o valor é junto à verdade, ainda dentro dos limites da verdade do que é e daquilo que pode ser, porque o que devia ser está contigo e pode ser, quando este comportamento... Ah, sim, este comportamento existe, há uma necessidade para este tipo de comportamento. Este comportamento existe porque em relações sociais de pequena escala são necessárias, são necessárias, não sem ter nada a ver com a questão da verdade, meramente pela questão da necessidade de continuação de ambientes internos e externos homeostásicos, ou como é que se diz, não é? De forma cultural, biológica e de seguida auto-preservação.",1020,1,5,alta,misto,desenvolvimento_medio,continuidade_argumentativa,False,False,segmentacao_semantica_duas_fases,exploracao,fundamento do comportamento necessário,comportamento | verdade | necessidade | homeostasia | auto-preservação,alto,alta,,,False,False,segmentado_auto,True,False,models/gemini-2.5-flash,resegmentador_semantico_v4_1_duas_fases,2026-03-11 01:06:37,formulacao_inicial,,introduz,introducao,auxiliar,solto_ainda_sem_encaixe,indefinida,False,False,False,False,nao_aplicavel,,etica,,material_a_retrabalhar,True,baixa,"Formula uma aproximação inicial entre verdade, comportamento e necessidade de preservação, mas a articulação é hesitante e não sustenta zona estrutural nem tipificação mais forte.",2,,,,2,,,,,
F0007_SEG_001,F0007,7,fragmentos.md,2026-01-02,## F0007 — 2026-01-02,"Vai sempre haver esse comportamento como necessidade do próprio sistema, e... E, pelo... por tudo, não é? Por tudo. O problema torna-se... ...quando esse tipo de comportamento é dominante. Porque quando esse tipo de comportamento, ou seja, esse tipo de pessoa... pode ser qualquer tipo de personalidade... A questão é quando esse tipo se torna o tipo. Neste caso da esquerda, o tipo que bifurca para a estrada da esquerda se torna dominante. Porquê? Porque, como dizia Jung, pensar é difícil. Por isso é que a maior parte das pessoas julgam. E quando esse tipo se torna dominante, domina quase totalmente só pelo simples facto de requerer menos esforço, como justificação de modo de existir, de viver, do que um que nos obrigue a destar energia.","Vai sempre haver esse comportamento como necessidade do próprio sistema, e... E, pelo... por tudo, não é? Por tudo. O problema torna-se... ...quando esse tipo de comportamento é dominante. Porque quando esse tipo de comportamento, ou seja, esse tipo de pessoa... pode ser qualquer tipo de personalidade... A questão é quando esse tipo se torna o tipo. Neste caso da esquerda, o tipo que bifurca para a estrada da esquerda se torna dominante. Porquê? Porque, como dizia Jung, pensar é difícil. Por isso é que a maior parte das pessoas julgam. E quando esse tipo se torna dominante, domina quase totalmente só pelo simples facto de requerer menos esforço, como justificação de modo de existir, de viver, do que um que nos obrigue a destar energia.",745,1,14,alta,misto,sequencia_argumentativa,continuidade_argumentativa,False,False,segmentacao_semantica_duas_fases,exploracao,comportamento dominante e esforço,comportamento dominante | menos esforço | julgar | pensar | tipo,alto,alta,,,False,False,segmentado_auto,True,False,models/gemini-2.5-flash,resegmentador_semantico_v4_1_duas_fases,2026-03-11 01:07:18,formulacao_inicial,,introduz,introducao,auxiliar,solto_ainda_sem_encaixe,indefinida,False,False,False,True,nao_aplicavel,,critica_de_erro,,material_a_retrabalhar,True,baixa,"O texto enuncia de modo ainda oral e aproximativo um problema de dominância comportamental ligado ao menor esforço, mas sem estabilização suficiente para classificar como crítica de erro forte, tipificar erro específico ou fixar zona estrutural.",3,,,,3,,,,,
F0013_SEG_001,F0013,13,fragmentos.md,2026-01-02,## F0013 — 2026-01-02,"Outro exemplo. O exemplo da tributação. O exemplo da tributação, no seu âmago, é uma análise e resposta ao problema de qual é o melhor modo de nos coordenarmos a todos, tendo como modo de análise a necessidade de, para corrigir, ou para corrigir não, porque inicialmente não foi para corrigir, agora a correção é só a justificação moderna para algo já implantado há muito tempo e cuja justificação era para alimentar os devaneios dos chefes de estados ou então necessidades militares. Tudo isso prende-se com existe um problema, então eu vou atuar mudando o sistema para melhor beneficiar, criando depois todo um conjunto de externalidades durante centenas e centenas de anos que completamente distorcem a única resposta possível. Um dos princípios básicos para a resposta do problema que será que é o homem que cria o sistema, não é o sistema que cria o homem. Olhando de uma perspectiva milenar, olhando de fora, vendo a sociedade unveiling itself, não sei como é que se diz em português. E tendo isso em conta, as ideias que se vão tendo, e que se vão disseminando e moldando a cultura, são, foram, levaram a que com o relativismo... Não. A primeira fase era no sentido de que, do ponto de vista da perceção, da maneira como o homem obtém conhecimento, do ponto de vista da perceção, é o modo mais adaptavelmente colante, tipo cola, que os humanos apreendem como crença naturalmente, pois está ligado a todos os tipos de pessoas, aos diferentes tipos de personalidade que cada pessoa tem e é. Porque uma crença dessa natureza tem de vir do relativismo. Mas o relativismo também no sentido de... pronto, no sentido de crença coletiva. Que depois, nos séculos mais recentes, se transformou no quê? Se mascarou, se mascarou, se mascarou com uma forma científica, entre aspas, mas que é apenas um modo de dissipação, que é o melhor, que é o melhor, porquê? Porque traz consigo a presunção falsa, a presunção falsa de verdade. Que é das universidades, e dos antigos científicos, e dos especialistas intelectuais todos.","Outro exemplo. O exemplo da tributação. O exemplo da tributação, no seu âmago, é uma análise e resposta ao problema de qual é o melhor modo de nos coordenarmos a todos, tendo como modo de análise a necessidade de, para corrigir, ou para corrigir não, porque inicialmente não foi para corrigir, agora a correção é só a justificação moderna para algo já implantado há muito tempo e cuja justificação era para alimentar os devaneios dos chefes de estados ou então necessidades militares. Tudo isso prende-se com existe um problema, então eu vou atuar mudando o sistema para melhor beneficiar, criando depois todo um conjunto de externalidades durante centenas e centenas de anos que completamente distorcem a única resposta possível. Um dos princípios básicos para a resposta do problema que será que é o homem que cria o sistema, não é o sistema que cria o homem. Olhando de uma perspectiva milenar, olhando de fora, vendo a sociedade unveiling itself, não sei como é que se diz em português. E tendo isso em conta, as ideias que se vão tendo, e que se vão disseminando e moldando a cultura, são, foram, levaram a que com o relativismo... Não. A primeira fase era no sentido de que, do ponto de vista da perceção, da maneira como o homem obtém conhecimento, do ponto de vista da perceção, é o modo mais adaptavelmente colante, tipo cola, que os humanos apreendem como crença naturalmente, pois está ligado a todos os tipos de pessoas, aos diferentes tipos de personalidade que cada pessoa tem e é. Porque uma crença dessa natureza tem de vir do relativismo. Mas o relativismo também no sentido de... pronto, no sentido de crença coletiva. Que depois, nos séculos mais recentes, se transformou no quê? Se mascarou, se mascarou, se mascarou com uma forma científica, entre aspas, mas que é apenas um modo de dissipação, que é o melhor, que é o melhor, porquê? Porque traz consigo a presunção falsa, a presunção falsa de verdade. Que é das universidades, e dos antigos científicos, e dos especialistas intelectuais todos.",2016,1,16,alta,fragmento_editorial,desenvolvimento_curto,continuidade_reflexiva,False,False,segmentacao_semantica_duas_fases,exploracao,génese e distorção de sistemas,tributação | coordenação | relativismo | crença coletiva | falsa presunção verdade,alto,alta,,,False,False,segmentado_auto,True,False,models/gemini-2.5-flash,resegmentador_semantico_v4_1_duas_fases,2026-03-11 01:08:51,formulacao_inicial,,introduz,introducao,dispersivo_aproveitavel,solto_ainda_sem_encaixe,indefinida,False,False,False,True,nao_aplicavel,,aplicacao,,material_a_retrabalhar,True,baixa,"O texto ensaia um exemplo sobre tributação e coordenação social, mas permanece oral, instável e sem formulação crítica suficientemente fixada para sustentar zona ou tipificação mais forte.",4,,,,4,,,,,
F0025_SEG_001,F0025,26,fragmentos.md,2026-01-02,## F0025 — 2026-01-02,"A crença falsa do formalista da verdade consiste em não buscar a verdade, mas outras coisas, e por isso não propaga qualquer verdade. O intelectualista, o comentarista, qualquer pessoa com alcance comunicacional suficiente para implantar ideias de forma expressiva, incorre neste risco. O revés é que essa pessoa acaba por encarnar a crença que justifica formalmente — muitas vezes através de uma verborreia conceptual (frequentemente kantiana) que tenta enquadrar teorias com premissas erradas, exigindo autojustificações cada vez mais complexas. Assim, a pessoa passa a ser essa crença. O significado da vida encontra-se no tipo de vida que se tem, isto é, no modo de ser. Se o homem faz parte do que é, e é a única entidade conhecida que sabe que é dentro do que é, então o seu modo de ser tem de conformar-se ao real, sem permissões para justificações alternativas. Tudo o que existe são evidências; dualismos sem correspondência no objeto descrito carecem de sentido.","A crença falsa do formalista da verdade consiste em não buscar a verdade, mas outras coisas, e por isso não propaga qualquer verdade. O intelectualista, o comentarista, qualquer pessoa com alcance comunicacional suficiente para implantar ideias de forma expressiva, incorre neste risco. O revés é que essa pessoa acaba por encarnar a crença que justifica formalmente — muitas vezes através de uma verborreia conceptual (frequentemente kantiana) que tenta enquadrar teorias com premissas erradas, exigindo autojustificações cada vez mais complexas. Assim, a pessoa passa a ser essa crença. O significado da vida encontra-se no tipo de vida que se tem, isto é, no modo de ser. Se o homem faz parte do que é, e é a única entidade conhecida que sabe que é dentro do que é, então o seu modo de ser tem de conformar-se ao real, sem permissões para justificações alternativas. Tudo o que existe são evidências; dualismos sem correspondência no objeto descrito carecem de sentido.",972,1,7,alta,fragmento_reflexivo,sequencia_argumentativa,continuidade_argumentativa,False,False,segmentacao_semantica_duas_fases,exploracao,"verdade, ser e justificação",crença falsa | formalismo | autojustificação | realidade,alto,alta,,,False,False,segmentado_auto,True,False,models/gemini-2.5-flash,resegmentador_semantico_v4_1_duas_fases,2026-03-11 01:12:42,formulacao_inicial,,introduz,introducao,auxiliar,solto_ainda_sem_encaixe,indefinida,False,False,False,True,epistemologicos,,epistemologia,,material_a_retrabalhar,True,baixa,"O fragmento combina denúncia do formalismo, exigência de conformação ao real e recusa de dualismos, mas sem estabilizar claramente uma zona estrutural ou um tipo; a leitura mais prudente é a de formulação inicial com incidência lateral sobre erro epistemológico.",5,,,,5,,,,,
F0042_SEG_001,F0042,42,fragmentos.md,2026-01-02,## F0042 — 2026-01-02,"A questão central é que é a verdade do ser que a esquerda necessita da direita para se enquadrar; sem isso, degenera. A direita fornece a ciência e a espada; a esquerda, o ideal e a morte. Trata-se de uma necessidade do sistema: a forma preserva-se nos seus meandros, especialmente com a existência de meios de comunicação que ultrapassam o local. Estamos neste ponto da história humana: descobrimos o processo e adaptamo-nos a ele, até que aquilo que sustenta o processo se imponha. Tudo isto são tautologias: o real descobre-se observando o movimento dos ponteiros do relógio da vida humana. Os ponteiros são os homens — se fossem pedras, as horas não mudariam. O real é o real. A relação, ainda enquanto relação, continua a ser real.","A questão central é que é a verdade do ser que a esquerda necessita da direita para se enquadrar; sem isso, degenera. A direita fornece a ciência e a espada; a esquerda, o ideal e a morte. Trata-se de uma necessidade do sistema: a forma preserva-se nos seus meandros, especialmente com a existência de meios de comunicação que ultrapassam o local. Estamos neste ponto da história humana: descobrimos o processo e adaptamo-nos a ele, até que aquilo que sustenta o processo se imponha. Tudo isto são tautologias: o real descobre-se observando o movimento dos ponteiros do relógio da vida humana. Os ponteiros são os homens — se fossem pedras, as horas não mudariam. O real é o real. A relação, ainda enquanto relação, continua a ser real.",736,1,8,alta,fragmento_reflexivo,desenvolvimento_medio,continuidade_reflexiva,False,False,segmentacao_semantica_duas_fases,exploracao,dinâmica sistémica e realidade,esquerda | direita | sistema | real | processo,alto,alta,,,False,False,segmentado_auto,True,False,models/gemini-2.5-flash,resegmentador_semantico_v4_1_duas_fases,2026-03-11 01:16:18,formulacao_inicial,,introduz,introducao,auxiliar,solto_ainda_sem_encaixe,indefinida,False,False,False,True,deslocamentos_e_derivados,degeneracao,critica_de_erro,,material_a_retrabalhar,True,baixa,"Formula uma tese inicial sobre dependência entre polos e degeneração sem estabilizar enquadramento conceptual; há incidência em erro de modo ainda ensaístico, o que não sustenta zona estrutural nem tipificação forte.",6,,,,6,,,,,
F0074_A01_SEG_001,F0074_A01,79,fragmentos.md,,"## F0074 — Inteligência, adaptação e erro da validação formal","Agora, tendo a conhecer-se… Não, se tendo a conhecer-me, imagina. Aconteceu que esta forma que nós chamamos de inteligência, e que se vê no ser humano, existe. Quer dizer, se outros seres vivos pudessem surgir do ponto de vista civilizacional como nós… Se eu vos disse não, não, mas não é preciso. Se eu vos disse não, sim, no sentido de terem tido a sorte de poder andar aí num ambiente em que se pudessem mexer e confortanizar, e aumentar os seus grupos, e por isso aumentar ou melhorar, ou viver através da própria existência de um grupo que se comunica e que desenvolve uma consciência… Quer dizer, é outra consciência. Assim como logo nós temos uma consciência, e por isso é logo uma coisa natural.

Ah, é uma coisa… o universo é mesmo feito para isso. Não, não é nada disso. Nada disso. É um absurdo sequer achar isso, visto que tu tens as nossas longas conversas. E faz-me alguma confusão.","Agora, tendo a conhecer-se… Não, se tendo a conhecer-me, imagina. Aconteceu que esta forma que nós chamamos de inteligência, e que se vê no ser humano, existe. Quer dizer, se outros seres vivos pudessem surgir do ponto de vista civilizacional como nós… Se eu vos disse não, não, mas não é preciso. Se eu vos disse não, sim, no sentido de terem tido a sorte de poder andar aí num ambiente em que se pudessem mexer e confortanizar, e aumentar os seus grupos, e por isso aumentar ou melhorar, ou viver através da própria existência de um grupo que se comunica e que desenvolve uma consciência… Quer dizer, é outra consciência. Assim como logo nós temos uma consciência, e por isso é logo uma coisa natural.

Ah, é uma coisa… o universo é mesmo feito para isso. Não, não é nada disso. Nada disso. É um absurdo sequer achar isso, visto que tu tens as nossas longas conversas. E faz-me alguma confusão.",896,2,10,alta,fragmento_reflexivo,sequencia_argumentativa,continuidade_argumentativa,True,True,segmentacao_semantica_duas_fases,exploracao,emergência inteligência e consciência,inteligência | consciência | emergência | condições | absurdo,alto,alta,,F0074_A01_SEG_002,False,True,segmentado_auto,True,False,models/gemini-2.5-flash,resegmentador_semantico_v4_1_duas_fases,2026-03-11 01:32:20,formulacao_inicial,,introduz,introducao,transitorio,solto_ainda_sem_encaixe,indefinida,False,True,False,True,nao_aplicavel,,antropologia,,material_a_retrabalhar,True,baixa,"Fragmento hesitante e oral que ensaia uma formulação inicial sobre inteligência e consciência e rejeita no final uma leitura teleológica, mas sem estabilizar zona estrutural nem tipo. A incidência sobre erro existe, porém sem apoio suficiente para especificação forte.",7,,,,7,,,,,
F0076_SEG_001,F0076,82,fragmentos.md,,"## F0076 — Mistura de modos de ser, presença e continuidade da consciência","Estava a pensar em como a mistura de modos de ser é aquilo que leva à ampliação do campo das possibilidades. E que, na falta de expansão comunicacional como a moderna, a presença era um requisito. As sociedades locais vivem da abertura do real que outras sociedades trazem, pelo menos enquanto não se vive de acordo com o real — e isso requer mais aprimoramento do conhecimento técnico. E esse conhecimento só existe por contacto.

Na cabeça de cada um só vive o que lá vive. É no pensamento do outro que está o interruptor da luz. A captura de mais potencialidades, a abertura do modo de ser à liberdade ontológica, deixa de ser necessária quando o conhecimento deixa de ser local. A homogeneidade das sociedades hoje já não é o oposto da captação de potencialidades. A pólis tornou desnecessária a sociedade cosmopolita.","Estava a pensar em como a mistura de modos de ser é aquilo que leva à ampliação do campo das possibilidades. E que, na falta de expansão comunicacional como a moderna, a presença era um requisito. As sociedades locais vivem da abertura do real que outras sociedades trazem, pelo menos enquanto não se vive de acordo com o real — e isso requer mais aprimoramento do conhecimento técnico. E esse conhecimento só existe por contacto.

Na cabeça de cada um só vive o que lá vive. É no pensamento do outro que está o interruptor da luz. A captura de mais potencialidades, a abertura do modo de ser à liberdade ontológica, deixa de ser necessária quando o conhecimento deixa de ser local. A homogeneidade das sociedades hoje já não é o oposto da captação de potencialidades. A pólis tornou desnecessária a sociedade cosmopolita.",822,2,9,alta,fragmento_reflexivo,sequencia_argumentativa,continuidade_argumentativa,True,True,segmentacao_semantica_duas_fases,desenvolvimento,"conhecimento, sociedade, possibilidades",campo de possibilidades | conhecimento técnico | contacto social | homogeneidade social,alto,alta,,F0076_SEG_002,False,True,segmentado_auto,True,False,models/gemini-2.5-flash,resegmentador_semantico_v4_1_duas_fases,2026-03-11 01:34:17,formulacao_inicial,,introduz,introducao,auxiliar,solto_ainda_sem_encaixe,indefinida,False,True,False,False,nao_aplicavel,,antropologia,,material_a_retrabalhar,True,baixa,"O texto introduz uma hipótese sobre contacto, conhecimento e abertura de possibilidades sociais, mas a formulação permanece ensaística e sem ancoragem estrutural suficiente para fixar zona ou tipo; por prudência, mantém-se indefinida e pede revisão humana.",8,,,,8,,,,,
