F0093_A01_SEG_002,F0093_A01,106,fragmentos.md,,"## F0093 — Crítica ao utilitarismo moral, ideologia, morte da filosofia e ismos como racionalizações","Ele não entra sequer na lista de filósofos a considerar; é um ideólogo. Hoje não há filósofos porque se matou a filosofia. A filosofia dominante é a agnóstica, como só poderia ser, por achar que o objeto da filosofia é o porquê e não o que é. Operando no campo do que não se sabe, o filósofo reina no agnosticismo e na cacofonia dos léxicos internos.

O que se vê são redescobertas de pontos de vista antigos: neo-aristotelismos, neo-platonismos. Mas o ponto de vista deveria ser encarar o mundo com a sua própria trilogia e o homem a agir nele com as suas virtudes, sem postular uma barreira entre a realidade e a apreensão.

Qualquer filosofia acaba sempre por repetir isto. Ninguém se preocupa em sair deste ponto de vista. Não se pergunta como se deve pensar, apenas se pensa. A filosofia retirou-se da sua utilidade, e o homem perdeu qualquer farol de sabedoria.","Ele não entra sequer na lista de filósofos a considerar; é um ideólogo. Hoje não há filósofos porque se matou a filosofia. A filosofia dominante é a agnóstica, como só poderia ser, por achar que o objeto da filosofia é o porquê e não o que é. Operando no campo do que não se sabe, o filósofo reina no agnosticismo e na cacofonia dos léxicos internos.

O que se vê são redescobertas de pontos de vista antigos: neo-aristotelismos, neo-platonismos. Mas o ponto de vista deveria ser encarar o mundo com a sua própria trilogia e o homem a agir nele com as suas virtudes, sem postular uma barreira entre a realidade e a apreensão.

Qualquer filosofia acaba sempre por repetir isto. Ninguém se preocupa em sair deste ponto de vista. Não se pergunta como se deve pensar, apenas se pensa. A filosofia retirou-se da sua utilidade, e o homem perdeu qualquer farol de sabedoria.",867,3,10,alta,fragmento_reflexivo,sequencia_argumentativa,continuidade_argumentativa,True,True,segmentacao_semantica_duas_fases,critica,estado e declínio da filosofia,filosofia | ideólogo | agnosticismo | utilidade | sabedoria,alto,alta,F0093_A01_SEG_001,F0093_A01_SEG_003,True,True,segmentado_auto,True,False,models/gemini-2.5-flash,resegmentador_semantico_v4_1_duas_fases,2026-03-11 01:48:28,critica_de_erro,,prolonga,desenvolvimento,auxiliar,solto_ainda_sem_encaixe,indefinida,False,True,False,True,epistemologicos,,critica_de_erro,,material_a_retrabalhar,True,media,"O texto sustenta sobretudo uma crítica ao agnosticismo e ao afastamento da filosofia face ao real, mas de modo ensaístico e pouco estabilizado; não há base suficiente para fixar zona estrutural, erro dominante forte ou tipo fragmentário específico.",90,,,,79,,,,,
F0155_SEG_001,F0155,186,fragmentos.md,,## F0155,"verá, ah, o que se tem de ter, não se vivendo no modo ser, de ser do real, mas ser do eu, é que leva às necessidades, à necessidade de pensar-se que tudo que, como o campo é autojustificado, então que nada vale, que verdade, justiça, bem, que nada vale, que o real nada vale.","verá, ah, o que se tem de ter, não se vivendo no modo ser, de ser do real, mas ser do eu, é que leva às necessidades, à necessidade de pensar-se que tudo que, como o campo é autojustificado, então que nada vale, que verdade, justiça, bem, que nada vale, que o real nada vale.",275,1,1,media,misto,distincao_conceptual,continuidade_argumentativa,False,False,segmentacao_semantica_duas_fases,distincao,ser do eu e niilismo,necessidades | autojustificado | nada vale,alto,alta,,,False,False,segmentado_auto,True,False,models/gemini-2.5-flash,resegmentador_semantico_v4_1_duas_fases,2026-03-11 02:24:26,critica_de_erro,,introduz,introducao,auxiliar,solto_ainda_sem_encaixe,indefinida,False,False,False,True,critica_reflexividade,projecao_do_eu,critica_de_erro,,material_a_retrabalhar,True,media,"O fragmento diagnostica que viver no 'ser do eu' conduz a uma desvalorização niilista de verdade, justiça, bem e do real; há crítica de desvio reflexivo, mas a formulação oral e condensada pede revisão humana.",91,,,,80,,,,,
F0166_SEG_001,F0166,197,fragmentos.md,,## F0166,"E isto incorpora também, depois de se saber o que é, pela absoluta especialização e tecnicização e proliferação de léxico da ciência, no fundo do conhecimento das regularidades físicas, depois disto, pela incapacidade operativa de quem estuda filosofia ter obrigatoriamente de não saber tudo o resto, esta compartimentalização que é necessária pela grandeza do modo de apreensão do ser consciente reflexivo, reconduzir a filosofia à metafísica. Num simples contexto, reconduzir a filosofia ao campo do que se acha que é, que se acha que pode ser, que se acha que deve ser.","E isto incorpora também, depois de se saber o que é, pela absoluta especialização e tecnicização e proliferação de léxico da ciência, no fundo do conhecimento das regularidades físicas, depois disto, pela incapacidade operativa de quem estuda filosofia ter obrigatoriamente de não saber tudo o resto, esta compartimentalização que é necessária pela grandeza do modo de apreensão do ser consciente reflexivo, reconduzir a filosofia à metafísica. Num simples contexto, reconduzir a filosofia ao campo do que se acha que é, que se acha que pode ser, que se acha que deve ser.",572,1,2,alta,misto,desenvolvimento_medio,continuidade_tematica,False,False,segmentacao_semantica_duas_fases,desenvolvimento,recondução filosofia à metafísica,especialização | tecnicização | compartimentalização | metafísica | filosofia,alto,alta,,,False,False,segmentado_auto,True,False,models/gemini-2.5-flash,resegmentador_semantico_v4_1_duas_fases,2026-03-11 02:26:51,critica_de_erro,,introduz,introducao,auxiliar,solto_ainda_sem_encaixe,indefinida,False,False,False,True,deslocamentos_e_derivados,inversao_direcional,critica_de_erro,,material_a_retrabalhar,True,media,"O fragmento critica a recondução da filosofia a um campo metafísico do que se acha que é, pode ser e deve ser, sugerindo desvio metodológico por especialização e compartimentalização, mas a formulação é oral e pouco estabilizada.",92,,,,81,,,,,
F0186_SEG_001,F0186,217,fragmentos.md,,## F0186,"A esquerda é como se vivesse como o estado paizinho, à espera sempre, vive no enquadramento do papá paizinho, faltando depois, como é óbvio, qualquer tipo de incentivo, qualquer tipo sequer de caminho potencial para que o espaço de liberdade do ser consciente reflexivo possa fazer qualquer outra coisa que não seja viver dentro dos próprios sistemas. E por isso restringe o mérito, restringe o real, o mérito é somente o bem andado no real.","A esquerda é como se vivesse como o estado paizinho, à espera sempre, vive no enquadramento do papá paizinho, faltando depois, como é óbvio, qualquer tipo de incentivo, qualquer tipo sequer de caminho potencial para que o espaço de liberdade do ser consciente reflexivo possa fazer qualquer outra coisa que não seja viver dentro dos próprios sistemas. E por isso restringe o mérito, restringe o real, o mérito é somente o bem andado no real.",441,1,2,media,misto,sequencia_argumentativa,continuidade_argumentativa,False,False,segmentacao_semantica_duas_fases,critica,"esquerda, estado paizinho, mérito",estado paizinho | incentivo | liberdade | mérito | sistemas,alto,alta,,,False,False,segmentado_auto,True,False,models/gemini-2.5-flash,resegmentador_semantico_v4_1_duas_fases,2026-03-11 02:31:18,critica_de_erro,,introduz,introducao,auxiliar,solto_ainda_sem_encaixe,indefinida,False,False,False,True,deslocamentos_e_derivados,,critica_de_erro,,material_a_retrabalhar,True,media,"O texto formula uma crítica a uma posição política por confinar a liberdade a sistemas e empobrecer a noção de mérito, mas fá-lo de modo oral e pouco estabilizado. Há incidência sobre erro de enquadramento, sem apoio suficiente para fixar zona estrutural ou erro dominante forte.",93,,,,82,,,,,
F0187_SEG_001,F0187,218,fragmentos.md,,## F0187,"Do outro lado, à direita, a direita política, na direita federal, a direita política, num espaço que vive, num espaço europeu, eu estava a dizer o que era, que vive na mesma lógica de submissão, não, de relegar o real, de não ter o real em conta, para viver no próprio sistema, mas confundindo o sistema com o real. Uns ao menos acham que não há real, outros confundem o sistema com o real. É igual, quer dizer, ao menos não, é igual, é a mesma coisa, uns confundem e outros acham que não há. Quer dizer, a mesma coisa, não, ao menos no modo direto, há uma pequenina similitude com o pelo menos subjugar o eu ao real, ainda que o real não seja o real, no caso deles. E estas flutuações políticas são justificadas pelos únicos modos de que existem que podem existir num ser consciente refletido, que é ser aquilo que é real e que há de viver com dois planos obrigatórios, que a regulação assim o obriga, o eu e o real. E é o que está ali no meio, que é o que ele faz disto.","Do outro lado, à direita, a direita política, na direita federal, a direita política, num espaço que vive, num espaço europeu, eu estava a dizer o que era, que vive na mesma lógica de submissão, não, de relegar o real, de não ter o real em conta, para viver no próprio sistema, mas confundindo o sistema com o real. Uns ao menos acham que não há real, outros confundem o sistema com o real. É igual, quer dizer, ao menos não, é igual, é a mesma coisa, uns confundem e outros acham que não há. Quer dizer, a mesma coisa, não, ao menos no modo direto, há uma pequenina similitude com o pelo menos subjugar o eu ao real, ainda que o real não seja o real, no caso deles. E estas flutuações políticas são justificadas pelos únicos modos de que existem que podem existir num ser consciente refletido, que é ser aquilo que é real e que há de viver com dois planos obrigatórios, que a regulação assim o obriga, o eu e o real. E é o que está ali no meio, que é o que ele faz disto.",972,1,6,alta,fragmento_editorial,desenvolvimento_medio,continuidade_argumentativa,False,False,segmentacao_semantica_duas_fases,exploracao,relação sistema real eu,real | sistema | eu | política | submissão,alto,alta,,,False,False,segmentado_auto,True,False,models/gemini-2.5-flash,resegmentador_semantico_v4_1_duas_fases,2026-03-11 02:31:32,critica_de_erro,,desloca,desenvolvimento,dispersivo_aproveitavel,solto_ainda_sem_encaixe,indefinida,False,False,False,True,critica_sistemica,substituicao_do_real_por_sistema,critica_de_erro,,material_a_retrabalhar,True,media,"O fragmento critica explicitamente a confusão entre sistema e real no plano político, mas a formulação é oral, flutuante e sem encaixe estrutural estável suficiente.",94,,,,83,,,,,
F0190_SEG_001,F0190,221,fragmentos.md,,## F0190,"Ah, não, não sabes o que é que é socialismo. Não, isso não é socialismo. Principalmente em Portugal existe esta conversa, confunde socialismo com social, com orientado para o social, com integrar o outro num sistema de crenças, com essa conversa toda do fundo que radica apenas para uma atitude mais ou menos genérica de, pá, reconhecer que o outro existe. Depois vai ao nível mais absurdo e mais básico, depois permite tudo, como o outro existe qualquer coisa, irrelevante. Como o outro é, como nós somos, como aquilo que é, é, pronto. E independentemente destas coisas todas, já sabem como é que as coisas funcionam. Mas não, então socialismo é o quê? Quais é que receitas de tudo aquilo que caracteriza o socialismo? Porque tens uma representação com simbólica diferente daquilo que é o socialismo. Socialismo, falarem em si, dito, não, porque não é comunismo. Ah, não, não, não é autoritarismo. Não, não. É somente o quê? É somente o quê? É somente, eu digo-te o que é somente, é só na relação mais básica que está aqui, de maneira abrangente, é na proposição de uma qualquer coisa que não serve perante o real. É isto, é um dever ser que, porque canalizado pela própria apreensão da realidade, quando o real faz-se mostrar, faz-se evidenciar, não muda o modo de ser, o modo de pensar, o modo de dizer nada do proponente. É uma crença, é uma manifestação de um modo de ser, de um modo de agir, que cobre todas as decisões, todas as ações, todo o contínuo do ser no ser, que é a resposta mais básica, mais intuitiva, que cola mais rápido, que se manifesta no nosso modo relacional, nós não nos relacionamos, eu não me relaciono com pessoas da China, quer dizer, é local. E é aquilo que vem à primeira, à cabeça, assim que se pensa em qualquer tema, qualquer tema do real, há necessariamente logo um enquadramento na perspectiva do eu para o real.","Ah, não, não sabes o que é que é socialismo. Não, isso não é socialismo. Principalmente em Portugal existe esta conversa, confunde socialismo com social, com orientado para o social, com integrar o outro num sistema de crenças, com essa conversa toda do fundo que radica apenas para uma atitude mais ou menos genérica de, pá, reconhecer que o outro existe. Depois vai ao nível mais absurdo e mais básico, depois permite tudo, como o outro existe qualquer coisa, irrelevante. Como o outro é, como nós somos, como aquilo que é, é, pronto. E independentemente destas coisas todas, já sabem como é que as coisas funcionam. Mas não, então socialismo é o quê? Quais é que receitas de tudo aquilo que caracteriza o socialismo? Porque tens uma representação com simbólica diferente daquilo que é o socialismo. Socialismo, falarem em si, dito, não, porque não é comunismo. Ah, não, não, não é autoritarismo. Não, não. É somente o quê? É somente o quê? É somente, eu digo-te o que é somente, é só na relação mais básica que está aqui, de maneira abrangente, é na proposição de uma qualquer coisa que não serve perante o real. É isto, é um dever ser que, porque canalizado pela própria apreensão da realidade, quando o real faz-se mostrar, faz-se evidenciar, não muda o modo de ser, o modo de pensar, o modo de dizer nada do proponente. É uma crença, é uma manifestação de um modo de ser, de um modo de agir, que cobre todas as decisões, todas as ações, todo o contínuo do ser no ser, que é a resposta mais básica, mais intuitiva, que cola mais rápido, que se manifesta no nosso modo relacional, nós não nos relacionamos, eu não me relaciono com pessoas da China, quer dizer, é local. E é aquilo que vem à primeira, à cabeça, assim que se pensa em qualquer tema, qualquer tema do real, há necessariamente logo um enquadramento na perspectiva do eu para o real.",1849,1,18,alta,fragmento_editorial,sequencia_argumentativa,continuidade_argumentativa,False,False,segmentacao_semantica_duas_fases,critica,conceito de socialismo inadequado,socialismo | social | real | crença,alto,alta,,,False,False,segmentado_auto,True,False,models/gemini-2.5-flash,resegmentador_semantico_v4_1_duas_fases,2026-03-11 02:32:09,critica_de_erro,,introduz,introducao,auxiliar,solto_ainda_sem_encaixe,indefinida,False,False,False,True,deslocamentos_e_derivados,moralizacao_indevida,critica_de_erro,,material_a_retrabalhar,True,media,"O fragmento critica uma representação inadequada de “socialismo” como dever-ser/crença que não se corrige perante o real, mas a formulação é oral, instável e ainda sem encaixe estrutural claro no percurso.",95,,,,84,,,,,
F0225_SEG_001,F0225,256,fragmentos.md,,## F0225,"Não há zombies filosóficos, há altivistas que por terem tipos de pensamento vêm nos outros pensamentos menos altivos, tão altivos que vivem no ar, senão como se domaria o anseio de andar com deus, onde os altivos crêem andar. Há somente pensamentos que se têm por se terem tido, o modo de ser inclui o modo de pensar e se o que me defronta diariamente é o ser material físico certo qual a lógica de inserir um pensamento teórico na cadeia ? Sou zombie por seguir o caminho onde ando? Sou mais snobe por achar que duvidar do caminho a todo o instante é que faz de mim aware","Não há zombies filosóficos, há altivistas que por terem tipos de pensamento vêm nos outros pensamentos menos altivos, tão altivos que vivem no ar, senão como se domaria o anseio de andar com deus, onde os altivos crêem andar. Há somente pensamentos que se têm por se terem tido, o modo de ser inclui o modo de pensar e se o que me defronta diariamente é o ser material físico certo qual a lógica de inserir um pensamento teórico na cadeia ? Sou zombie por seguir o caminho onde ando? Sou mais snobe por achar que duvidar do caminho a todo o instante é que faz de mim aware",572,1,4,alta,misto,desenvolvimento_medio,continuidade_tematica,False,False,segmentacao_semantica_duas_fases,exploracao,"altivismo, pensamento, ser, caminho",altivismo | pensamento | caminho | dúvida,alto,alta,,,False,False,segmentado_auto,True,False,models/gemini-2.5-flash,resegmentador_semantico_v4_1_duas_fases,2026-03-11 02:40:39,critica_de_erro,,introduz,introducao,exploratorio,solto_ainda_sem_encaixe,indefinida,False,False,False,True,critica_reflexividade,substancializacao_do_eu_ou_consciencia,critica_de_erro,fragmento_intuitivo,material_a_retrabalhar,True,media,"O fragmento ataca uma postura de altivez teórica desligada do ser material e critica um pensamento que se toma por superior; há crítica de erro reflexivo, mas em formulação ensaística e ainda pouco estabilizada.",96,,,,85,,,,,
F0241_A06_SEG_002,F0241_A06,276,fragmentos.md,,## F0241,"A filosofia é tão fraca, tão carreirista, tão formalista, tão cheia de eu-ego, que nunca pensaria em colocar Thomas Sowell como filósofo. Porém, os mecanismos que ele descreve, um dos inúmeros exemplos, pelas simples frases, por exemplo, de que as pessoas não buscam a verdade, não a encontram relativamente a modos de ser do eu-ego, modos de ser do ser no real, na relação com o real, é absurdo no que a filosofia se tornou, ou no que nunca foi, no que deixou de ser depois de Aristóteles.

Sim, é bem visto. Sim, porque já não há filosofia, há só discurso sobre filosofia. Havia há uns tempos num programa qualquer, não sei se era o Pampleycast, em que eles gostavam de sempre fazer perguntas aos convidados, no fim, acho eu, no início, não tenho ideia já, o que é que para eles era a filosofia? E havia toda, ai, era uma prática, ai, era um conhecimento, ai, era um sei lá, o que é que eles diziam? Ai, a filosofia já não deve existir e deve ser absorvida pela ciência. Sei lá, coisas assim. E um de um lado e do outro. Então, o jogo do sistema é tão grande, eles vivem tanto no sistema que eles criaram, que nem descrever a sua própria atividade dentro desse sistema conseguem.","A filosofia é tão fraca, tão carreirista, tão formalista, tão cheia de eu-ego, que nunca pensaria em colocar Thomas Sowell como filósofo. Porém, os mecanismos que ele descreve, um dos inúmeros exemplos, pelas simples frases, por exemplo, de que as pessoas não buscam a verdade, não a encontram relativamente a modos de ser do eu-ego, modos de ser do ser no real, na relação com o real, é absurdo no que a filosofia se tornou, ou no que nunca foi, no que deixou de ser depois de Aristóteles.

Sim, é bem visto. Sim, porque já não há filosofia, há só discurso sobre filosofia. Havia há uns tempos num programa qualquer, não sei se era o Pampleycast, em que eles gostavam de sempre fazer perguntas aos convidados, no fim, acho eu, no início, não tenho ideia já, o que é que para eles era a filosofia? E havia toda, ai, era uma prática, ai, era um conhecimento, ai, era um sei lá, o que é que eles diziam? Ai, a filosofia já não deve existir e deve ser absorvida pela ciência. Sei lá, coisas assim. E um de um lado e do outro. Então, o jogo do sistema é tão grande, eles vivem tanto no sistema que eles criaram, que nem descrever a sua própria atividade dentro desse sistema conseguem.",1181,2,10,alta,fragmento_editorial,sequencia_argumentativa,continuidade_argumentativa,True,True,segmentacao_semantica_duas_fases,critica,crise da filosofia contemporânea,filosofia | declínio | ego | sistema | discurso,alto,alta,F0241_A06_SEG_001,F0241_A06_SEG_003,True,True,segmentado_auto,True,False,models/gemini-2.5-flash,resegmentador_semantico_v4_1_duas_fases,2026-03-11 02:48:56,critica_de_erro,,prolonga,desenvolvimento,auxiliar,solto_ainda_sem_encaixe,indefinida,False,True,False,True,critica_sistemica,fechamento_simbolico,critica_de_erro,critica_fechamento_simbolico,material_a_retrabalhar,True,media,"O fragmento prolonga uma denúncia da degradação da filosofia em discurso autocentrado e sistémico, criticando incapacidade descritiva e fechamento interno, mas de modo oral e ainda pouco estabilizado.",97,,,,86,,,,,
F0241_A07_SEG_004,F0241_A07,277,fragmentos.md,,## F0241,"O argumento do Andrew Wilson da objetividade da moralidade pelo comando divino é uma tentativa de salvar o que eu diria que é apreensível, tocável, experienciável, o mundo das coisas criado por Deus, algo assim. Mas a questão é, pela fraca descrição que todos têm, mesmo aqueles que tentam percorrer o caminho do real por não lhe darem ao real o estatuto que querem, por retirarem completamente da equação para a humanidade ter-se abstido de oferecer qualquer tipo de estatuto ao real ao ponto de que a melhor salvação é mudá-lo por Deus por um ente qualquer intencional.","O argumento do Andrew Wilson da objetividade da moralidade pelo comando divino é uma tentativa de salvar o que eu diria que é apreensível, tocável, experienciável, o mundo das coisas criado por Deus, algo assim. Mas a questão é, pela fraca descrição que todos têm, mesmo aqueles que tentam percorrer o caminho do real por não lhe darem ao real o estatuto que querem, por retirarem completamente da equação para a humanidade ter-se abstido de oferecer qualquer tipo de estatuto ao real ao ponto de que a melhor salvação é mudá-lo por Deus por um ente qualquer intencional.",571,1,2,alta,fragmento_editorial,sequencia_argumentativa,continuidade_argumentativa,False,True,segmentacao_semantica_duas_fases,desenvolvimento,problema objetividade moralidade divina,objetividade moral | comando divino | mundo real | estatuto real | ente intencional,alto,alta,F0241_A07_SEG_003,,True,False,segmentado_auto,True,False,models/gemini-2.5-flash,resegmentador_semantico_v4_1_duas_fases,2026-03-11 02:49:54,critica_de_erro,,fecha,conclusao_local,auxiliar,solto_ainda_sem_encaixe,indefinida,False,False,True,True,epistemologicos,nao_submissao_ao_real,critica_de_erro,submissao_ao_real,material_a_retrabalhar,True,media,"O fragmento fecha localmente uma crítica à tentativa de fundar a objetividade moral por comando divino, acusando uma descrição fraca que retira estatuto ao real e o substitui por um ente intencional. A incidência crítica sobre desajuste ao real é clara, mas a formulação é oral e instável.",98,,,,87,,,,,
