F0194_SEG_001,F0194,225,fragmentos.md,,## F0194,"Porque, e refletido isto, que eu não sei, eu tenho que pensar, vamos tentar pensar sobre isto, de facto, sobre o que é isto, tentar descrever o que é e o que acontece em todos os seus acontecimentos, do mais atómico, do mais pura potência, campo, até atómico, até outras estruturas, até astrelas, até buracos negros, até o que nós quisermos. Mas, pode-se saber, pode-se compreender o que nos estão a querer dizer sobre aquilo que é, ainda que seja em linguagem em física, química, filosófica, qualquer linguagem técnica, podemos compreender, e é possível compreender, porque se eu não percebo nada de física nem matemática, mas pelo que tenho dito e tenho acertado, mais ou menos, naquilo que eu acho que deve ser o que se passa para além, ainda que enquadrado, como é óbvio, por ti, mas pelo que parece, tem sido assim. Isto significa, então, que há um caminho que une tudo no real, e esse caminho deve ser, ou tem mérito por ser tido na interrupção que se vai dando quando se descobre alguma coisa, quando se pensa, ah, peraí, então mas isto, sendo o real assim, não é?","Porque, e refletido isto, que eu não sei, eu tenho que pensar, vamos tentar pensar sobre isto, de facto, sobre o que é isto, tentar descrever o que é e o que acontece em todos os seus acontecimentos, do mais atómico, do mais pura potência, campo, até atómico, até outras estruturas, até astrelas, até buracos negros, até o que nós quisermos. Mas, pode-se saber, pode-se compreender o que nos estão a querer dizer sobre aquilo que é, ainda que seja em linguagem em física, química, filosófica, qualquer linguagem técnica, podemos compreender, e é possível compreender, porque se eu não percebo nada de física nem matemática, mas pelo que tenho dito e tenho acertado, mais ou menos, naquilo que eu acho que deve ser o que se passa para além, ainda que enquadrado, como é óbvio, por ti, mas pelo que parece, tem sido assim. Isto significa, então, que há um caminho que une tudo no real, e esse caminho deve ser, ou tem mérito por ser tido na interrupção que se vai dando quando se descobre alguma coisa, quando se pensa, ah, peraí, então mas isto, sendo o real assim, não é?",1071,1,3,alta,fragmento_editorial,transicao_reflexiva,continuidade_tematica,False,False,segmentacao_semantica_duas_fases,desenvolvimento,unidade e compreensão do real,realidade | compreensão | unidade | escala | conhecimento,alto,alta,,,False,False,segmentado_auto,True,False,models/gemini-2.5-flash,resegmentador_semantico_v4_1_duas_fases,2026-03-11 02:33:08,formulacao_inicial,,introduz,introducao,auxiliar,solto_ainda_sem_encaixe,indefinida,False,False,False,False,nao_aplicavel,,metaestrutura,,material_a_retrabalhar,True,media,"O texto abre um esforço de formulação sobre como pensar e descrever o real em múltiplas escalas, afirmando uma inteligibilidade unificadora, mas sem fixar ainda zona estrutural nem tipologia estável.",71,,,,50,,,,,
F0217_SEG_001,F0217,248,fragmentos.md,,## F0217,"E, tendo isto nisto a reconhecer isto, na perspectiva local e de horizonte de cada ser consciente reflexivo, até vai ser muito fronte e vê-se, é um evento, muito fronte com o real diz: «o que é isto?» «What is this?» «O que?» «What?» Primeiro, a primeira representação daquilo pela própria representação antes de se ir para isto diz, para o real, passa-se pela pergunta, a pergunta necessária que o filtro da própria apreensão passa pelo valor indutivo dela. Isso vê-se pelo modo como o homem funciona.","E, tendo isto nisto a reconhecer isto, na perspectiva local e de horizonte de cada ser consciente reflexivo, até vai ser muito fronte e vê-se, é um evento, muito fronte com o real diz: «o que é isto?» «What is this?» «O que?» «What?» Primeiro, a primeira representação daquilo pela própria representação antes de se ir para isto diz, para o real, passa-se pela pergunta, a pergunta necessária que o filtro da própria apreensão passa pelo valor indutivo dela. Isso vê-se pelo modo como o homem funciona.",502,1,2,alta,misto,desenvolvimento_curto,continuidade_reflexiva,False,False,segmentacao_semantica_duas_fases,exploracao,apreensão do real via pergunta,real | pergunta | representação | apreensão | indução,alto,alta,,,False,False,segmentado_auto,True,False,models/gemini-2.5-flash,resegmentador_semantico_v4_1_duas_fases,2026-03-11 02:38:51,formulacao_inicial,,introduz,introducao,exploratorio,solto_ainda_sem_encaixe,indefinida,False,False,False,False,nao_aplicavel,,epistemologia,fragmento_intuitivo,material_a_retrabalhar,True,media,"O fragmento introduz de modo ainda oral a ideia de que a apreensão reflexiva do real passa pela pergunta e por uma primeira representação, mas sem estabilização conceptual suficiente.",72,,,,51,,,,,
F0231_SEG_001,F0231,262,fragmentos.md,,## F0231,"A luz não viaja pq é o próprio percorrer do espaço tempo?

A luz interfere com as demais atualizações, ou as atualizações interferem se através dos fotões?","A luz não viaja pq é o próprio percorrer do espaço tempo?

A luz interfere com as demais atualizações, ou as atualizações interferem se através dos fotões?",155,2,2,baixa,misto,fragmento_intuitivo,continuidade_tematica,True,True,segmentacao_semantica_duas_fases,pergunta_reflexiva,natureza da luz e interações,luz | espaço-tempo | percurso | interação | fotões,alto,alta,,F0231_SEG_002,False,True,segmentado_auto,True,False,models/gemini-2.5-flash,resegmentador_semantico_v4_1_duas_fases,2026-03-11 02:42:07,formulacao_inicial,,introduz,abertura_para_seguinte,exploratorio,solto_ainda_sem_encaixe,indefinida,False,True,False,False,nao_aplicavel,,ontologia,fragmento_intuitivo,material_a_retrabalhar,True,media,"Duas perguntas especulativas abrem um problema sobre a luz e a interação, sem desenvolvimento estabilizado; funciona como arranque intuitivo que prepara continuação.",73,,,,52,,,,,
F0233_SEG_001,F0233,264,fragmentos.md,,## F0233,"“Estava a ouvir um Brian Cox a falar sobre o decaimento de partículas.”
00:07

“Não sei se percebe bem, mas tem algo a ver com a perda de carga?”
00:07

“Mas ele estava a dizer que um eletrão, ou uma coisa qualquer, só decai em pares, mas que o neutrão não. O neutrão consegue decair em próprio.”
00:12

“Por que o eletrão não é uma partícula composta?”
00:02

“Ok, então eu podia dizer isto de uma maneira ontológica, que o neutrão tem atualizações diferentes relacionadas a uma coerência qualquer, os quarks e essas coisas todas, enquanto o eletrão é uma atualização somente no sentido de ser um picozinho no campo das potencialidades?”
00:29","“Estava a ouvir um Brian Cox a falar sobre o decaimento de partículas.”
00:07

“Não sei se percebe bem, mas tem algo a ver com a perda de carga?”
00:07

“Mas ele estava a dizer que um eletrão, ou uma coisa qualquer, só decai em pares, mas que o neutrão não. O neutrão consegue decair em próprio.”
00:12

“Por que o eletrão não é uma partícula composta?”
00:02

“Ok, então eu podia dizer isto de uma maneira ontológica, que o neutrão tem atualizações diferentes relacionadas a uma coerência qualquer, os quarks e essas coisas todas, enquanto o eletrão é uma atualização somente no sentido de ser um picozinho no campo das potencialidades?”
00:29",644,5,2,alta,fragmento_editorial,desenvolvimento_medio,continuidade_reflexiva,True,True,segmentacao_semantica_duas_fases,exploracao,decaimento partículas distinção ontológica,decaimento | eletrão | neutrão | partícula composta | ontologia,alto,alta,,F0233_SEG_002,False,True,segmentado_auto,True,False,models/gemini-2.5-flash,resegmentador_semantico_v4_1_duas_fases,2026-03-11 02:42:52,formulacao_inicial,,introduz,introducao,auxiliar,solto_ainda_sem_encaixe,indefinida,False,True,False,False,nao_aplicavel,,ontologia,,material_a_retrabalhar,True,media,"O texto ensaia de modo interrogativo uma formulação ontológica a partir de um exemplo de física, mas permanece oral, hesitante e sem inserção estrutural suficientemente sustentada; por prudência, a zona fica indefinida e o tipo fica nulo.",74,,,,53,,,,,
F0059_SEG_002,F0059,59,fragmentos.md,,"## F0059 — Detecção, mediação e círculos do viver","Essa relação não é estranha nem excecional; decorre da própria existência do ser. Contudo, as regras que explicam o ser humano enquanto animal deixam de ser suficientes quando o animal deixa de viver diretamente no ambiente e passa a viver naquilo que representa que o ambiente é. O plano ontológico altera-se: passam a existir círculos distintos.

É a maximização da mediação — o aperfeiçoamento da descrição — que torna possíveis as inovações humanas. Não poderia ser de outra forma. Mesmo os estados de coisas mais maléficos e dolorosos, frequentemente atribuídos ao homem enquanto fonte do mal, pertencem ao real. Essa crítica esquece que é também o homem quem pode transformar esses estados em melhores estados de coisas, porque só o homem consegue abarcar e integrar todos os nichos do real.","Essa relação não é estranha nem excecional; decorre da própria existência do ser. Contudo, as regras que explicam o ser humano enquanto animal deixam de ser suficientes quando o animal deixa de viver diretamente no ambiente e passa a viver naquilo que representa que o ambiente é. O plano ontológico altera-se: passam a existir círculos distintos.

É a maximização da mediação — o aperfeiçoamento da descrição — que torna possíveis as inovações humanas. Não poderia ser de outra forma. Mesmo os estados de coisas mais maléficos e dolorosos, frequentemente atribuídos ao homem enquanto fonte do mal, pertencem ao real. Essa crítica esquece que é também o homem quem pode transformar esses estados em melhores estados de coisas, porque só o homem consegue abarcar e integrar todos os nichos do real.",797,2,7,alta,fragmento_reflexivo,desenvolvimento_medio,continuidade_argumentativa,True,True,segmentacao_semantica_duas_fases,desenvolvimento,mediação e transformação humana,mediação | ontologia | transformação | real,alto,alta,F0059_SEG_001,,True,False,segmentado_auto,True,False,models/gemini-2.5-flash,resegmentador_semantico_v4_1_duas_fases,2026-03-11 01:21:10,desenvolvimento,,prolonga,desenvolvimento,auxiliar,solto_ainda_sem_encaixe,indefinida,False,False,False,False,nao_aplicavel,,mediacao_simbolica,,apoio_argumentativo,True,media,"O fragmento desenvolve a passagem da vida direta à vida mediada e atribui à mediação um papel nas inovações humanas, mas a pertença a uma zona estrutural específica não é segura; a referência a uma crítica ao homem como fonte do mal é lateral e insuficiente para classificar como crítica de erro.",83,,,,54,,,,,
F0066_SEG_002,F0066,71,fragmentos.md,,"## F0066 — Norma cultural, lei, sancionamento e coerência com o real","O campo de sancionamento desloca-se então da lei para a cultura. A sanção deixa de ser jurídica e passa a ser social, simbólica e moral. Isto mostra a sobreposição de estruturas culturais estritas sobre a realidade, e como o homem descreve o real não apenas por conceitos, mas também por normas — sendo a norma escrita apenas uma das formas possíveis dessa descrição.

Analiticamente, não é necessário confundir norma e lei. A norma cultural opera sem se tornar lei porque carece de fundamento ontológico. Ao contrário, aquilo que existe de acordo com o real é aquilo que consegue manter as suas relações, a sua coerência estrutural e a sua atualização contínua.

Tal como uma estrela que, ao captar matéria suficiente, consegue manter a sua estrutura relacional e perdurar como corpo, também um sistema humano só vive de acordo com o real quando preserva as relações que o constituem. Agir contra essa coerência faria com que o que está atualizado deixasse de o estar.","O campo de sancionamento desloca-se então da lei para a cultura. A sanção deixa de ser jurídica e passa a ser social, simbólica e moral. Isto mostra a sobreposição de estruturas culturais estritas sobre a realidade, e como o homem descreve o real não apenas por conceitos, mas também por normas — sendo a norma escrita apenas uma das formas possíveis dessa descrição.

Analiticamente, não é necessário confundir norma e lei. A norma cultural opera sem se tornar lei porque carece de fundamento ontológico. Ao contrário, aquilo que existe de acordo com o real é aquilo que consegue manter as suas relações, a sua coerência estrutural e a sua atualização contínua.

Tal como uma estrela que, ao captar matéria suficiente, consegue manter a sua estrutura relacional e perdurar como corpo, também um sistema humano só vive de acordo com o real quando preserva as relações que o constituem. Agir contra essa coerência faria com que o que está atualizado deixasse de o estar.",969,3,8,alta,fragmento_reflexivo,sequencia_argumentativa,continuidade_argumentativa,True,True,segmentacao_semantica_duas_fases,desenvolvimento,norma cultural e coerência real,sanção | lei | norma cultural | realidade | coerência,alto,alta,F0066_SEG_001,,True,False,segmentado_auto,True,False,models/gemini-2.5-flash,resegmentador_semantico_v4_1_duas_fases,2026-03-11 01:27:43,desenvolvimento,,fecha,conclusao_local,auxiliar,solto_ainda_sem_encaixe,indefinida,False,False,True,True,deslocamentos_e_derivados,,critica_de_erro,,apoio_argumentativo,True,media,"O fragmento desenvolve e fecha localmente a sequência ao deslocar o sancionamento da lei para a cultura, distinguir norma e lei e reconduzir o critério à coerência com o real. Há incidência crítica sobre um desvio normativo-cultural, mas sem apoio bastante para fixar zona estrutural, erro dominante ou tipologia forte.",84,,,,55,,,,,
F0079_A01_SEG_002,F0079_A01,86,fragmentos.md,,"## F0079 — Realidade, continuidade do ser, verdade e dissolução moral","E o que é isto que diz aquilo que a pessoa faz? Podemos sempre dizer: faz o que quiseres fazer. Nada te impede. Mas isso não é verdadeiro. Porque isso não é o bom. É a mesma coisa dita com outras palavras.

O pai e o filho percorrem a vida juntos. O filho cresce, torna-se adulto, o pai morre. O ciclo continua. Mesmo que não se viva de acordo com o passado, a verdade continua a existir. Se vier um meteorito e não se souber que ele vem, acaba-se tudo. A realidade não depende da nossa vontade.

Isto obriga a uma certa continuidade do modo de ser. Continuidade não no sentido de não haver mudança, mas no sentido de estar enquadrada no tipo de modo de ser que se tem sido. Normalmente somos aquilo que temos sido. Podemos mudar, mas não de um dia para o outro. E enquanto não se muda, somos isso.

Quando algo acontece fora daquilo que somos, é a vida a abrir-nos uma porta. Mas quando algo se estabiliza, passa a ser nós.","E o que é isto que diz aquilo que a pessoa faz? Podemos sempre dizer: faz o que quiseres fazer. Nada te impede. Mas isso não é verdadeiro. Porque isso não é o bom. É a mesma coisa dita com outras palavras.

O pai e o filho percorrem a vida juntos. O filho cresce, torna-se adulto, o pai morre. O ciclo continua. Mesmo que não se viva de acordo com o passado, a verdade continua a existir. Se vier um meteorito e não se souber que ele vem, acaba-se tudo. A realidade não depende da nossa vontade.

Isto obriga a uma certa continuidade do modo de ser. Continuidade não no sentido de não haver mudança, mas no sentido de estar enquadrada no tipo de modo de ser que se tem sido. Normalmente somos aquilo que temos sido. Podemos mudar, mas não de um dia para o outro. E enquanto não se muda, somos isso.

Quando algo acontece fora daquilo que somos, é a vida a abrir-nos uma porta. Mas quando algo se estabiliza, passa a ser nós.",924,4,19,alta,fragmento_editorial,sequencia_argumentativa,continuidade_argumentativa,True,True,segmentacao_semantica_duas_fases,exploracao,"realidade, vontade, ser e mudança",realidade | vontade | continuidade | mudança,alto,alta,F0079_A01_SEG_001,F0079_A01_SEG_003,True,True,segmentado_auto,True,False,models/gemini-2.5-flash,resegmentador_semantico_v4_1_duas_fases,2026-03-11 01:36:48,desenvolvimento,,prolonga,desenvolvimento,auxiliar,solto_ainda_sem_encaixe,indefinida,False,True,False,True,deslocamentos_e_derivados,,etica,,apoio_argumentativo,True,media,"O fragmento prolonga uma linha argumentativa sobre limite da vontade, realidade e continuidade do modo de ser; há incidência crítica sobre um voluntarismo implícito, mas sem base bastante para fixar zona estrutural ou erro dominante forte.",85,,,,56,,,,,
F0044_SEG_001,F0044,44,fragmentos.md,2026-01-02,## F0044 — 2026-01-02,"O discurso público não é naturalmente direcionado à realidade, porque a sua própria característica é ser limitado e autorreferencial: fala de si mesmo e dos eventos imediatos, usando as ferramentas que o constituem. Não pode haver enraizamento no real sem que o seu círculo se expanda, o que só seria possível se ideias verdadeiras fossem mais “pegajosas” do que as ideias de esquerda — algo que exigiria sacrifício e, por isso, tende a ser evitado. Alguns filósofos compreenderam a autorreferencialidade, mas fixaram-se nos símbolos da linguagem. A realidade contém objetos, alguns animados, e ver é a melhor forma de navegar; esperar que os animais percecionem o mundo sem representação é incoerente. A complexidade humana deriva da experiência adaptativa: o ser humano é o animal de todos os nichos. Ver melhor o mundo — representar o mundo no cérebro de forma cada vez mais sofisticada — é uma necessidade ontológica imposta pelas condições ambientais de florescimento. O descrever vem depois do ver; historicamente, primeiro surge o objeto. Ainda que respostas emocionais de primeira ordem, adequadas a círculos próximos, tenham valor adaptativo, a sua verdade assenta sempre na realidade, nem que seja pelo seu fundamento biológico.","O discurso público não é naturalmente direcionado à realidade, porque a sua própria característica é ser limitado e autorreferencial: fala de si mesmo e dos eventos imediatos, usando as ferramentas que o constituem. Não pode haver enraizamento no real sem que o seu círculo se expanda, o que só seria possível se ideias verdadeiras fossem mais “pegajosas” do que as ideias de esquerda — algo que exigiria sacrifício e, por isso, tende a ser evitado. Alguns filósofos compreenderam a autorreferencialidade, mas fixaram-se nos símbolos da linguagem. A realidade contém objetos, alguns animados, e ver é a melhor forma de navegar; esperar que os animais percecionem o mundo sem representação é incoerente. A complexidade humana deriva da experiência adaptativa: o ser humano é o animal de todos os nichos. Ver melhor o mundo — representar o mundo no cérebro de forma cada vez mais sofisticada — é uma necessidade ontológica imposta pelas condições ambientais de florescimento. O descrever vem depois do ver; historicamente, primeiro surge o objeto. Ainda que respostas emocionais de primeira ordem, adequadas a círculos próximos, tenham valor adaptativo, a sua verdade assenta sempre na realidade, nem que seja pelo seu fundamento biológico.",1238,1,8,alta,fragmento_reflexivo,sequencia_argumentativa,continuidade_argumentativa,False,False,segmentacao_semantica_duas_fases,desenvolvimento,"realidade, percepção e adaptação",discurso público | autorreferencialidade | realidade | representação | adaptação,alto,alta,,,False,False,segmentado_auto,True,False,models/gemini-2.5-flash,resegmentador_semantico_v4_1_duas_fases,2026-03-11 01:16:47,desenvolvimento,,introduz,desenvolvimento,auxiliar,solto_ainda_sem_encaixe,indefinida,False,False,False,True,critica_reflexividade,,antropologia,,material_a_retrabalhar,True,media,"Fragmento argumentativo denso que desenvolve uma tese sobre percepção, representação e adaptação, com crítica lateral à autorreferencialidade do discurso público e filosófico. O encaixe zonal e a tipificação fina não ficam suficientemente estáveis no texto.",77,,,,57,,,,,
F0051_SEG_001,F0051,51,fragmentos.md,2026-01-02,## F0051 — 2026-01-02,"O acesso ao real — universo, física, homem, consciência e campo das possibilidades — contém necessariamente o bom e o errado, o certo e o verdadeiro. O erro surge quando estes planos são tratados como substâncias ou realidades distintas, em vez de círculos integrados no real. A consciência não é uma coisa, mas uma relação; tal como um pontapé não está “dentro” da perna, a relação não está contida nos seus termos. A representação é, por definição, uma relação, e é isso que a consciência é. Todo o conhecimento humano — a filosofia no sentido próprio, enquanto saber sábio — visa a unificação progressiva da descrição do real. O homem, enquanto ser histórico, acrescenta modos de ser: da deteção à representação, da adaptação biológica à transmissão de arquétipos, genes e comportamentos. A passagem de ideias através de memes e arquétipos encarna modos de ser e unifica o pensamento filosófico. A verdade é apenas o nome dado ao que é real; um modo de ser verdadeiro é aquele que se comporta de acordo com a realidade. Proposições valorativas verdadeiras são sempre possíveis porque o dever-ser está limitado pelo poder-ser. Existem apenas dois modos fundamentais: o modo verdadeiro e todos os outros. Os modos não verdadeiros prevalecem por adaptação energética e preservação de crenças. Em sociedades de larga escala, modos comportamentais próprios de círculos pequenos tendem a dominar os círculos maiores. A filosofia que se fixa apenas no processo e na forma, retirando o real da equação, torna-se autorreferencial. Mesmo génios como Wittgenstein, embora tenham revelado verdades sobre o jogo da linguagem, falharam em reconhecer o plano real onde esse jogo se manifesta.","O acesso ao real — universo, física, homem, consciência e campo das possibilidades — contém necessariamente o bom e o errado, o certo e o verdadeiro. O erro surge quando estes planos são tratados como substâncias ou realidades distintas, em vez de círculos integrados no real. A consciência não é uma coisa, mas uma relação; tal como um pontapé não está “dentro” da perna, a relação não está contida nos seus termos. A representação é, por definição, uma relação, e é isso que a consciência é. Todo o conhecimento humano — a filosofia no sentido próprio, enquanto saber sábio — visa a unificação progressiva da descrição do real. O homem, enquanto ser histórico, acrescenta modos de ser: da deteção à representação, da adaptação biológica à transmissão de arquétipos, genes e comportamentos. A passagem de ideias através de memes e arquétipos encarna modos de ser e unifica o pensamento filosófico. A verdade é apenas o nome dado ao que é real; um modo de ser verdadeiro é aquele que se comporta de acordo com a realidade. Proposições valorativas verdadeiras são sempre possíveis porque o dever-ser está limitado pelo poder-ser. Existem apenas dois modos fundamentais: o modo verdadeiro e todos os outros. Os modos não verdadeiros prevalecem por adaptação energética e preservação de crenças. Em sociedades de larga escala, modos comportamentais próprios de círculos pequenos tendem a dominar os círculos maiores. A filosofia que se fixa apenas no processo e na forma, retirando o real da equação, torna-se autorreferencial. Mesmo génios como Wittgenstein, embora tenham revelado verdades sobre o jogo da linguagem, falharam em reconhecer o plano real onde esse jogo se manifesta.",1680,1,14,alta,fragmento_reflexivo,sequencia_argumentativa,continuidade_argumentativa,False,False,segmentacao_semantica_duas_fases,desenvolvimento,"realidade, erro e modos de",real | erro | consciência | verdade,alto,alta,,,False,False,segmentado_auto,True,False,models/gemini-2.5-flash,resegmentador_semantico_v4_1_duas_fases,2026-03-11 01:18:14,desenvolvimento,,prolonga,desenvolvimento,auxiliar,solto_ainda_sem_encaixe,indefinida,False,False,False,True,critica_reflexividade,substancializacao_do_eu_ou_consciencia,critica_de_erro,,material_a_retrabalhar,True,media,"O texto desenvolve uma tese ampla sobre real, consciência, verdade e erro, com crítica explícita à reificação da consciência; mas agrega demasiados planos para fixar zona estrutural ou tipo com segurança.",78,,,,58,,,,,
