F0016_SEG_001,F0016,16,fragmentos.md,2026-01-02,## F0016 — 2026-01-02,"Ah, a questão era da necessidade. A questão era da necessidade de, obviamente, que o valor do trabalho, no fundo, o valor da vida do homem, o valor do tempo que dá e do gasto e do sacrifício que faz, o valor da vida do homem, vai ser menor. Vai ser menor, vai ser infinitamente menor. Não sendo mau nem bom. No sentido de ser mau, apenas. Não é bom. Não, tem que ser mau, como eu ouço. Tem que ser mau. Tem que ser mau. Pelo menos desta forma. Desta forma em que delega, em benefício do trabalho, a função natural da sobrevivência da espécie que recai sobre a mulher. E, quer dizer, se é para ser o conhecedor da estrutura e, por isso, advocador dos exercícios físicos, e, por isso, advocar as soluções falsas, porque não se é conhecedor, colocas as soluções ao tempo de aula. Mas se é para ter esta força, se é para ter a forma de quem conhece a estrutura, que é uma forma linda na percepção de uma verdade, de uma realidade. Só aí é que a estética vai estar incluída na perfeição filosófica do ser. Porque este modo de ser, sem o ser assim, é risível, porque não é autêntico no sentido de não encarnar a necessidade descritiva para a aplicação valorativa. Porque o ser faz parte do real. Portanto, além das constituições que isso obriga, sendo um ser consciente, sendo um ser com consciência e com capacidade de agir livremente, de construir, de moldar, de destruir, de reconstruir... Então, sobre ele recai quase que uma necessidade de ser derivada da própria realidade. Se eu estou a conduzir, eu sei que tenho de manter-me a uma grande velocidade, com controle longo, duradouro, sobre o carro, de caminho volante e assim por diante. E ser algo diferente é, pelo seu efeito imediato, imediatamente, também salvo pelo enasmo, tido como errado, absurdo, estúpido. Mas a aplicação do... O desvelar, o desvendar, o abrir da cortina dos efeitos de modo de ser falsos é mais lenta, não é duradoura, é mais lenta, não é? Demora tempo. Porque é a necessidade biológica de sermos um animal que leva às consequências inevitáveis da estruturação. Quanto mais afastada da verdade está, mais errada está, mais falsa está. A cadência da evolução das ideias filosóficas e científicas, que são as únicas que me interessam. E científicas são filosóficas. Porque filosofia é o modo de ser de apreensão da realidade. Portanto, quer dizer, está tudo um bocado nesse aspecto adentro da filosofia. Pronto, e o ponto era que a cadência que existe de se ver, a cadência histórica da evolução das ideias filosóficas, é o guião para a compreensão da realidade. Porque é sobre elas que culmina a evidência, as evidências que eu ando aqui a dizer.","Ah, a questão era da necessidade. A questão era da necessidade de, obviamente, que o valor do trabalho, no fundo, o valor da vida do homem, o valor do tempo que dá e do gasto e do sacrifício que faz, o valor da vida do homem, vai ser menor. Vai ser menor, vai ser infinitamente menor. Não sendo mau nem bom. No sentido de ser mau, apenas. Não é bom. Não, tem que ser mau, como eu ouço. Tem que ser mau. Tem que ser mau. Pelo menos desta forma. Desta forma em que delega, em benefício do trabalho, a função natural da sobrevivência da espécie que recai sobre a mulher. E, quer dizer, se é para ser o conhecedor da estrutura e, por isso, advocador dos exercícios físicos, e, por isso, advocar as soluções falsas, porque não se é conhecedor, colocas as soluções ao tempo de aula. Mas se é para ter esta força, se é para ter a forma de quem conhece a estrutura, que é uma forma linda na percepção de uma verdade, de uma realidade. Só aí é que a estética vai estar incluída na perfeição filosófica do ser. Porque este modo de ser, sem o ser assim, é risível, porque não é autêntico no sentido de não encarnar a necessidade descritiva para a aplicação valorativa. Porque o ser faz parte do real. Portanto, além das constituições que isso obriga, sendo um ser consciente, sendo um ser com consciência e com capacidade de agir livremente, de construir, de moldar, de destruir, de reconstruir... Então, sobre ele recai quase que uma necessidade de ser derivada da própria realidade. Se eu estou a conduzir, eu sei que tenho de manter-me a uma grande velocidade, com controle longo, duradouro, sobre o carro, de caminho volante e assim por diante. E ser algo diferente é, pelo seu efeito imediato, imediatamente, também salvo pelo enasmo, tido como errado, absurdo, estúpido. Mas a aplicação do... O desvelar, o desvendar, o abrir da cortina dos efeitos de modo de ser falsos é mais lenta, não é duradoura, é mais lenta, não é? Demora tempo. Porque é a necessidade biológica de sermos um animal que leva às consequências inevitáveis da estruturação. Quanto mais afastada da verdade está, mais errada está, mais falsa está. A cadência da evolução das ideias filosóficas e científicas, que são as únicas que me interessam. E científicas são filosóficas. Porque filosofia é o modo de ser de apreensão da realidade. Portanto, quer dizer, está tudo um bocado nesse aspecto adentro da filosofia. Pronto, e o ponto era que a cadência que existe de se ver, a cadência histórica da evolução das ideias filosóficas, é o guião para a compreensão da realidade. Porque é sobre elas que culmina a evidência, as evidências que eu ando aqui a dizer.",2623,1,31,alta,fragmento_editorial,sequencia_argumentativa,continuidade_argumentativa,False,False,segmentacao_semantica_duas_fases,desenvolvimento,"cadência filosófica, necessidade, realidade",necessidade | realidade | filosofia | cadência,alto,alta,,,False,False,segmentado_auto,True,False,models/gemini-2.5-flash,resegmentador_semantico_v4_1_duas_fases,2026-03-11 01:09:38,desenvolvimento,,prolonga,desenvolvimento,auxiliar,solto_ainda_sem_encaixe,indefinida,False,False,False,True,deslocamentos_e_derivados,,etica,,material_a_retrabalhar,True,baixa,"Fragmento longamente desenvolvimental, mas oral e instável, articulando necessidade, realidade e avaliação prática. Há incidência crítica sobre modos de ser falsos, porém sem apoio suficiente para fixar zona estrutural, erro dominante ou tipo de fragmento com segurança.",30,,,,29,,,,,
F0017_SEG_001,F0017,17,fragmentos.md,2026-01-02,## F0017 — 2026-01-02,"Calma... As verdadeiras... Nem preciso explicar porquê, não é? Se o único modo de apreensão que temos... Não, dizem que o único modo de apreensão que temos não é objetivo, então é uma mera... Reduz-se a um mero interesse. Mas não porque imitamos, porque os conceitos verdadeiros a que chegamos têm sempre de estar contidos nas próprias limitações do pode-ser, porque as proposições valorativas indexam-se sempre às posições descritivas através do pode-ser, que é diferente do deve-ser. Há uma limitação inerente. Porque é objetivamente verdade aquilo que está contido dentro da descrição da realidade sobre o qual se está a propor alguma coisa. E, logo, todas as críticas ao objetivismo, no ponto de vista da realidade objetiva das coisas e da capacidade de propor proposições valorativas sobre a realidade, caem. Nós não idolatramo(s) grupos de pessoas. Nós idolatramo(s) pessoas. Líderes. Aspirações. Heróis. E nada, era apenas mais uma evidência do porquê as aplicações, as respostas biológicas são apropriadas, nascem de círculos puxados. A ideia de um rendimento universal aplicado às empresas que produzem os robôs, que se tornarão, como é óbvio, substitutos de toda a ação humana, e que, com o pagamento dos impostos altíssimos sobre essas empresas, seria possível pagar um valor. Sem falar do próprio absurdo, que é impor impostos elevados a empresas. Empresas, porque é olhar para o coletivo em vez de olhar para o individual. Porque é esquecer que por detrás de toda a ficção jurídica existe uma ou umas, mas normalmente é uma pessoa, a decidir. A tomar as decisões, a tomar as ações. Portanto, se nessas condições não são favoráveis para agir neste mercado, simplesmente não vou agir neste mercado. Mas a questão não era essa. O segundo ponto é que era importante, porque tinha que era... Mas espera lá. Portanto, o valor do subsídio, que paga milhões de pessoas... Bilhões, talvez, não sei quantos é que são, 2, ou 3, ou 4, ou 5, ou 6 bilhões de pessoas, é pago com o produto da receita que a empresa que faz os robôs, ou as empresas que fazem os robôs, têm. Logo, significa que o valor cobrado tem que ser suficiente para distribuir pelas pessoas todas, além dos custos necessários que os Estados deste tipo de natureza têm. Sim, cométrica, que ridículo. O subsídio tinha de ser pago por dinheiro arrecadado da empresa que fosse o suficiente para gerar receitas e ainda pagar impostos ridiculamente altos. Estão a gerar receitas ridiculamente altas para pagar impostos ridiculamente altos. Enquanto paga uma proporção considerável, muito considerável, do seu lucro. E depois as pessoas iam pagar as prestações com o dinheiro que iriam receber do subsídio do Estado que era arrecadado pelos impostos nessas empresas? Hã? Como é que...? Mas tem-se isto? Se os robôs substituíam o homem na ação, no pensamento talvez não, mas na ação, se há ação que é componente para a própria mudança do mundo, se a ação inexiste, vamos ficar reduzidos a muitos poucos que vão explorar as máximas potencialidades dos robôs para aprimorar o desenvolvimento humano, que vão ser muito poucos e vão ser canalizados nos players dominantes dos setores, ou então o outcome vai ser que a generalidade das pessoas vai usar os robôs para a continuação do mesmo estilo de vida, apenas ilusoriamente mais desafogado, esperando até ao colapso, inevitável.","Calma... As verdadeiras... Nem preciso explicar porquê, não é? Se o único modo de apreensão que temos... Não, dizem que o único modo de apreensão que temos não é objetivo, então é uma mera... Reduz-se a um mero interesse. Mas não porque imitamos, porque os conceitos verdadeiros a que chegamos têm sempre de estar contidos nas próprias limitações do pode-ser, porque as proposições valorativas indexam-se sempre às posições descritivas através do pode-ser, que é diferente do deve-ser. Há uma limitação inerente. Porque é objetivamente verdade aquilo que está contido dentro da descrição da realidade sobre o qual se está a propor alguma coisa. E, logo, todas as críticas ao objetivismo, no ponto de vista da realidade objetiva das coisas e da capacidade de propor proposições valorativas sobre a realidade, caem. Nós não idolatramo(s) grupos de pessoas. Nós idolatramo(s) pessoas. Líderes. Aspirações. Heróis. E nada, era apenas mais uma evidência do porquê as aplicações, as respostas biológicas são apropriadas, nascem de círculos puxados. A ideia de um rendimento universal aplicado às empresas que produzem os robôs, que se tornarão, como é óbvio, substitutos de toda a ação humana, e que, com o pagamento dos impostos altíssimos sobre essas empresas, seria possível pagar um valor. Sem falar do próprio absurdo, que é impor impostos elevados a empresas. Empresas, porque é olhar para o coletivo em vez de olhar para o individual. Porque é esquecer que por detrás de toda a ficção jurídica existe uma ou umas, mas normalmente é uma pessoa, a decidir. A tomar as decisões, a tomar as ações. Portanto, se nessas condições não são favoráveis para agir neste mercado, simplesmente não vou agir neste mercado. Mas a questão não era essa. O segundo ponto é que era importante, porque tinha que era... Mas espera lá. Portanto, o valor do subsídio, que paga milhões de pessoas... Bilhões, talvez, não sei quantos é que são, 2, ou 3, ou 4, ou 5, ou 6 bilhões de pessoas, é pago com o produto da receita que a empresa que faz os robôs, ou as empresas que fazem os robôs, têm. Logo, significa que o valor cobrado tem que ser suficiente para distribuir pelas pessoas todas, além dos custos necessários que os Estados deste tipo de natureza têm. Sim, cométrica, que ridículo. O subsídio tinha de ser pago por dinheiro arrecadado da empresa que fosse o suficiente para gerar receitas e ainda pagar impostos ridiculamente altos. Estão a gerar receitas ridiculamente altas para pagar impostos ridiculamente altos. Enquanto paga uma proporção considerável, muito considerável, do seu lucro. E depois as pessoas iam pagar as prestações com o dinheiro que iriam receber do subsídio do Estado que era arrecadado pelos impostos nessas empresas? Hã? Como é que...? Mas tem-se isto? Se os robôs substituíam o homem na ação, no pensamento talvez não, mas na ação, se há ação que é componente para a própria mudança do mundo, se a ação inexiste, vamos ficar reduzidos a muitos poucos que vão explorar as máximas potencialidades dos robôs para aprimorar o desenvolvimento humano, que vão ser muito poucos e vão ser canalizados nos players dominantes dos setores, ou então o outcome vai ser que a generalidade das pessoas vai usar os robôs para a continuação do mesmo estilo de vida, apenas ilusoriamente mais desafogado, esperando até ao colapso, inevitável.",3337,1,37,alta,fragmento_editorial,sequencia_argumentativa,continuidade_argumentativa,False,False,segmentacao_semantica_duas_fases,critica,"automação, ubi e crítica econômica",objetividade | rendimento universal | robotização | impostos | ação humana,alto,alta,,,False,False,segmentado_auto,True,False,models/gemini-2.5-flash,resegmentador_semantico_v4_1_duas_fases,2026-03-11 01:09:48,desenvolvimento,,prolonga,desenvolvimento,dispersivo_aproveitavel,solto_ainda_sem_encaixe,indefinida,False,False,False,True,deslocamentos_e_derivados,,aplicacao,,material_a_retrabalhar,True,baixa,"Fragmento longo e heterogéneo, com passagem de formulação sobre objetividade para desenvolvimento crítico-aplicado sobre robotização e rendimento universal; a zona estrutural não fica sustentada, por isso mantém-se indefinida e sem tipificação forte.",31,,,,30,,,,,
F0023_SEG_001,F0023,24,fragmentos.md,2026-01-02,## F0023 — 2026-01-02,"O homem encontrou o caminho certo com a interação do cristianismo e da liberdade criativa, que seria o único sistema que permitiria tal coisa, ao ter uma representação básica dos melhores modos de ação com a religião que, em liberdade, pudessem aproximar-se mais do descobrimento do real e do bom. Demos passos importantíssimos com a descoberta da previsibilidade da física, isto é, das leis universais — do modo de ser do real. Ainda que com erros, como em Kant, que chegando bem à ideia inicial, extraiu depois remédios irreais, com todos os filósofos e cientistas obtivemos descrições cada vez melhores. O tempo da fundação dos EUA é um marco, porque associa a um enorme território e população um ethos verdadeiro: o homem deve ser livre e digno porque é filho de Deus — isto é, da realidade, criado dentro da realidade. Vê-se que as sociedades que mais criam e inovam são as que preservam este princípio. A Europa, mais tarde, já num tempo em que a receita básica estava teorizada, passou a operar sobre crenças acerca dessa receita; e, pela regra da maioria, criou sistemas cada vez mais racionalizados e labirínticos, cheios de limitações à busca da verdade pelo homem. Já não era a simplicidade e beleza da verdade que pesava na balança, mas a necessidade de limitar o homem segundo sistemas pobres em imaginação. São exemplos da verdade da verdade.","O homem encontrou o caminho certo com a interação do cristianismo e da liberdade criativa, que seria o único sistema que permitiria tal coisa, ao ter uma representação básica dos melhores modos de ação com a religião que, em liberdade, pudessem aproximar-se mais do descobrimento do real e do bom. Demos passos importantíssimos com a descoberta da previsibilidade da física, isto é, das leis universais — do modo de ser do real. Ainda que com erros, como em Kant, que chegando bem à ideia inicial, extraiu depois remédios irreais, com todos os filósofos e cientistas obtivemos descrições cada vez melhores. O tempo da fundação dos EUA é um marco, porque associa a um enorme território e população um ethos verdadeiro: o homem deve ser livre e digno porque é filho de Deus — isto é, da realidade, criado dentro da realidade. Vê-se que as sociedades que mais criam e inovam são as que preservam este princípio. A Europa, mais tarde, já num tempo em que a receita básica estava teorizada, passou a operar sobre crenças acerca dessa receita; e, pela regra da maioria, criou sistemas cada vez mais racionalizados e labirínticos, cheios de limitações à busca da verdade pelo homem. Já não era a simplicidade e beleza da verdade que pesava na balança, mas a necessidade de limitar o homem segundo sistemas pobres em imaginação. São exemplos da verdade da verdade.",1356,1,8,alta,fragmento_reflexivo,sequencia_argumentativa,continuidade_argumentativa,False,False,segmentacao_semantica_duas_fases,desenvolvimento,fundamentos e desvio societal,cristianismo | liberdade | realidade | ethos | sistemas,alto,alta,,,False,False,segmentado_auto,True,False,models/gemini-2.5-flash,resegmentador_semantico_v4_1_duas_fases,2026-03-11 01:11:59,desenvolvimento,,prolonga,desenvolvimento,auxiliar,solto_ainda_sem_encaixe,indefinida,False,False,False,True,deslocamentos_e_derivados,,aplicacao,,material_a_retrabalhar,True,baixa,"O texto desenvolve uma narrativa valorativa sobre liberdade, cristianismo, ciência e organização social, com exemplos históricos e crítica de desvios, mas sem fixação conceptual estável que permita atribuir zona estrutural ou erro dominante com segurança.",32,,,,31,,,,,
F0053_SEG_001,F0053,53,fragmentos.md,2026-01-02,## F0053 — 2026-01-02,"O ser, seja quem for, se existe, existe dentro do que lhe possibilita existir. Conhecer o real implica agir dentro dos seus limites: não se constrói uma casa com o telhado por baixo das paredes. O real é o que é, e o homem torna-o reconhecido, não apenas detetado como pelos outros animais. Vivendo no campo das possibilidades, qualquer proposição pode ser medida relativamente ao real, que é aquilo que permite o florescimento. A evolução humana prova isso: não foi pela estagnação, mas pela exploração, socialização e integração do real. A representação imagética — como a do tigre — permite antecipação e adaptação. Os arquétipos nascem dessa capacidade representacional e emocional, que no humano se desenvolve de forma ética e imagética avançada. A consciência emerge da capacidade de representação manipulável e comunicável, intensificada pela vida social. A ação livre existe dentro de um modo de ser inserido no real, sempre com referência a ele. O comportamento emocional é o mais adequado aos círculos menores onde a humanidade se formou, mas torna-se inadequado quando aplicado a círculos maiores, como civilizações, por não corresponder ao modo de ser exigido por esses níveis do real.","O ser, seja quem for, se existe, existe dentro do que lhe possibilita existir. Conhecer o real implica agir dentro dos seus limites: não se constrói uma casa com o telhado por baixo das paredes. O real é o que é, e o homem torna-o reconhecido, não apenas detetado como pelos outros animais. Vivendo no campo das possibilidades, qualquer proposição pode ser medida relativamente ao real, que é aquilo que permite o florescimento. A evolução humana prova isso: não foi pela estagnação, mas pela exploração, socialização e integração do real. A representação imagética — como a do tigre — permite antecipação e adaptação. Os arquétipos nascem dessa capacidade representacional e emocional, que no humano se desenvolve de forma ética e imagética avançada. A consciência emerge da capacidade de representação manipulável e comunicável, intensificada pela vida social. A ação livre existe dentro de um modo de ser inserido no real, sempre com referência a ele. O comportamento emocional é o mais adequado aos círculos menores onde a humanidade se formou, mas torna-se inadequado quando aplicado a círculos maiores, como civilizações, por não corresponder ao modo de ser exigido por esses níveis do real.",1197,1,10,alta,fragmento_reflexivo,sequencia_argumentativa,continuidade_argumentativa,False,False,segmentacao_semantica_duas_fases,exploracao,"realidade, ser, ação humana",real | representação | consciência | ação,alto,alta,,,False,False,segmentado_auto,True,False,models/gemini-2.5-flash,resegmentador_semantico_v4_1_duas_fases,2026-03-11 01:18:42,desenvolvimento,,prolonga,desenvolvimento,auxiliar,solto_ainda_sem_encaixe,indefinida,False,False,False,False,nao_aplicavel,,antropologia,,material_a_retrabalhar,True,baixa,"Sequência longa e cumulativa que desenvolve relações entre real, representação, consciência e ação humana, mas sem ancoragem estrutural suficiente para fixar zona do percurso ou tipificação forte; a nota final sobre círculos menores e civilizações sugere escala, porém de modo ainda lateral e insuficiente para classificar como crítica de erro.",33,,,,32,,,,,
